rank,school,type,grades,address,city,zip,county,district,year
389,Stony Lane Elementary School,Public,K-4,W 110 Ridgewood Avenue,Paramus,07652,Bergen County,Paramus Public School District,2017
390,Montague Township School,Public,"PK, KG-8",475 Route 206,Montague,07827,Sussex County,Montague Township School District,2017
391,Mary A. Hubbard Elementary School,Public,"PK, KG-3",10 Hubbard Lane,Ramsey,07446,Bergen County,Ramsey School District,2017
392,Mansfield Township Elementary School,Public,3-6,200 Mansfield Road East,Columbus,08022,Burlington County,Mansfield Township School District,2017
393,Roosevelt School,Public,"PK, KG-5",435 Passaic Avenue,Lodi,07644,Bergen County,Lodi School District,2017
394,William P Tatem Elementary School,Public,K-5,265 Lincoln Avenue,Collingswood,08108,Camden County,Collingswood Public School District,2017
395,West Freehold School,Public,"PK, KG-5",100 Castronova Way,Freehold,07728,Monmouth County,Freehold Township School District,2017
396,Washington Elementary School,Public,K-5,49 S  Summit Street,Bergenfield,07621,Bergen County,Bergenfield Borough School District,2017
397,Whitman Elementary School,Public,K-5,827 Whitman School Dr,Turnersville,08012,Gloucester County,Washington Township School District,2017
398,Bradford Elementary School,Public,"PK, KG-5",87 Mt Hebron Rd,Upper Montclair,07042,Essex County,Montclair Public School District,2017
399,Oldmans Township School,Public,"PK, KG-8",10 Freed Road,Pedricktown,08067,Salem County,Oldmans Township School District,2017
400,Sewell Elementary School,Public,PK-K,40 McAnally Dr,Sewell,08080,Gloucester County,Mantua Township School District,2017
401,Washington Elementary,Public,"PK, KG-4",301 Washington Avenue,Union,07083,Union County,Township of Union School District,2017
402,Brookdale Avenue School,Public,K-4,14 Brookdale Court,Verona,07044,Essex County,Verona Public School District,2017
403,Dennis B O'Brien Elementary School,Public,"PK, KG-5",16 Mineral Spring Drive,Dover,07801,Morris County,Rockaway Township School District,2017
404,Crescent Elementary School,Public,K-5,165 Crescent Avenue,Waldwick,07463,Bergen County,Waldwick School District,2017
405,Benedict A. Cucinella School,Public,"PK, KG-5",470 Naughright Road,Long Valley,07853,Morris County,Washington Township School District,2017
406,Salome H. Long Memorial School,Public,K-6,260 Floral Lane,Saddle Brook,07663,Bergen County,Saddle Brook School District,2017
407,Maria Varisco Rogers Charter School,"Public, Charter",K-8,233 Woodside Ave,Newark,07104,Essex County,Maria L. Varisco-Rogers Charter School,2017
408,Bedminster Township Public School,Public,"PK, KG-8",234 Somerville Road,Bedminster,07921,Somerset County,Bedminster Township Public School District,2017
409,Washington Elementary School,Public,K-5,600 School Street,Township Of Washington,07676,Bergen County,Westwood Regional School District,2017
410,Joseph J Catena School,Public,K-5,275 Burlington Road,Freehold,07728,Monmouth County,Freehold Township School District,2017
411,Dogwood Hill Elementary School,Public,K-5,25 Dogwood Dr,Oakland,07436,Bergen County,Oakland Public School District,2017
412,Indiana Avenue Elementary School,Public,K-5,Indiana Avenue,Iselin,08830,Middlesex County,Woodbridge Township School District,2017
413,Lincoln School,Public,"PK, KG-3",414 Montross Avenue,Rutherford,07070,Bergen County,Rutherford School District,2017
414,Memorial Elementary School,Public,K-5,11 Ely Ave,Laurence Harbor,08879,Middlesex County,Old Bridge Township School District,2017
415,Sharon School,Public,"PK, KG-4",234 Sharon Road,Robbinsville,08691,Mercer County,Robbinsville Public Schools,2017
416,Chester M. Stephens Elementary School,Public,"PK, KG-5",99 Sunset Drive,Budd Lake,07828,Morris County,Mount Olive Township School District,2017
417,Jessie F. George Elementary,Public,K-5,1 Palm Street,Township Of Washington,07676,Bergen County,Westwood Regional School District,2017
418,Community Park School,Public,"PK, KG-5",372 Witherspoon Street,Princeton,08540,Mercer County,Princeton Public School District,2017
419,Lincoln School,Public,"PK, KG-5",40 Mill Street,Pompton Lakes,07442,Passaic County,Pompton Lakes School District,2017
420,Washington Elementary School,Public,K-5,201 Central Ave,West Caldwell,07006,Essex County,Caldwell-West School District,2017
421,Grant Elementary School,Public,K-5,100 Grant Ave,Dumont,07628,Bergen County,Dumont Public School District,2017
422,McKinley Avenue Elementary School,Public,3-4,1000 McKinley Avenue,Manahawkin,08050,Ocean County,Stafford Township School District,2017
423,Brooklake School,Public,3-5,235 Brooklake Road,Florham Park,07932,Morris County,Florham Park School District,2017
424,Deerfield Elementary School,Public,3-8,302 Central Avenue,Mountainside,07092,Union County,Mountainside School District,2017
425,James Caldwell Elementary School,Public,3-5,36 Caldwell Place,Springfield,07081,Union County,Springfield Public School District,2017
426,Dwight D. Eisenhower Elementary School,Public,K-3,360 Stelton Road,Piscataway,08854,Middlesex County,Piscataway Township School District,2017
427,Constable Elementary School,Public,K-5,29 Constable Road,Kendall Park,08824,Middlesex County,South Brunswick School District,2017
428,Roosevelt Elementary School,Public,"PK, KG-4",135 Jackson Avenue,South Plainfield,07080,Middlesex County,South Plainfield School District,2017
429,School One Elementary,Public,"PK, KG-4",563 Willow Avenue,Scotch Plains,07076,Union County,Scotch Plains-Fanwood School District,2017
430,Franklin D Roosevelt Elementary School,Public,"PK, KG-5",50 Webster Street,North Arlington,07031,Bergen County,North Arlington School District,2017
431,University Heights Elementary School,Public,"PK, KG-5",645 Paxson Avenue,Hamilton,08690,Mercer County,Hamilton Township Public School District,2017
432,Newbury Elementary School,Public,3-5,179 Newbury Road,Howell,07731,Monmouth County,Howell Township Public School District,2017
433,Tewksbury Elementary School,Public,K-5,109 Fairmount Road East,Califon,07830,Hunterdon County,Tewksbury Township School District,2017
434,John F Kennedy Elementary School,Public,"PK, KG-4",2900 Norwood Avenue,South Plainfield,07080,Middlesex County,South Plainfield School District,2017
435,G. Harold Antrim Elementary School,Public,"PK, KG-8",401 Niblick Street,Point Pleasant Beach,08742,Ocean County,Point Pleasant Beach School District,2017
436,Osage School,Public,K-5,112 Somerdale Road,Voorhees,08043,Camden County,Voorhees Township School District,2017
437,Dr. Gerald H. Woehr Elementary School,Public,"PK, KG-5",44 N Main St,New Egypt,08533,Ocean County,Plumsted Township School District,2017
438,Clinton Elementary School,Public,"PK, KG-5",27 Berkshire Rd,Maplewood,07040,Essex County,South Orange-Maplewood School District,2017
439,Selzer Elementary/Middle School,Public,"PK, KG-8",435 Prospect Ave,Dumont,07628,Bergen County,Dumont Public School District,2017
440,Teaneck Community Charter school,"Public, Charter",K-8,563 Chestnut Avenue,Teaneck,07666,Bergen County,Teaneck Community Charter School,2017
441,Thomas Jefferson Elementary School,Public,K-5,100 Prospect Avenue,North Arlington,07031,Bergen County,North Arlington School District,2017
442,Mawbey Street Elementary School,Public,K-5,275 Mawbey Street,Woodbridge,07095,Middlesex County,Woodbridge Township School District,2017
443,Green Hills School,Public,K-8,69 Mackerly Road,Greendell,07839,Sussex County,Green Township School District,2017
444,James A. McDivitt Elementary School,Public,K-5,1 Manny Martin Way,Old Bridge,08857,Middlesex County,Old Bridge Township School District,2017
445,Horace Mann Elementary School,Public,K-5,150 Walt Whitman Blvd.,Cherry Hill,08003,Camden County,Cherry Hill School District,2017
446,Yardville Heights Elementary School,Public,K-5,3880 South Broad Street,Hamilton,08620,Mercer County,Hamilton Township Public School District,2017
447,Sussex Avenue School,Public,3-5,125 Sussex Avenue,Morristown,07960,Morris County,Morris School District,2017
448,Lincoln Elementary School,Public,K-5,80 Prospect Ave,Dumont,07628,Bergen County,Dumont Public School District,2017
449,Lopatcong Elementary School,Public,"PK, KG-4",263 Route 57,Phillipsburg,08865,Warren County,Lopatcong Township School District,2017
450,Parkview Elementary School,Public,"PK, KG-3",123 Parkview Rd,Stratford,08084,Camden County,Stratford School District,2017
451,Haskell Elementary School,Public,"PK, KG-8",973 Ringwood Avenue,Haskell,07420,Passaic County,Wanaque School District,2017
452,Robert Hunter Elementary School,Public,K-4,8 Dayton Road,Flemington,08822,Hunterdon County,Flemington-Raritan Regional School District,2017
453,Birchwood Elementary School,Public,"PK, KG-5",1 Art Street,Dover,07801,Morris County,Rockaway Township School District,2017
454,Elms Elementary School,Public,"PK, KG-5",780 Patterson Road,Jackson,08527,Ocean County,Jackson Township School District,2017
455,Adamsville Primary School,Public,"PK, KG-4",400 Union Avenue,Bridgewater,08807,Somerset County,Bridgewater-Raritan Regional School District,2017
456,Washington School,Public,"PK, KG-5",310 N  Main Street,Lodi,07644,Bergen County,Lodi School District,2017
457,Ironia School,Public,K-5,303 Dover  Chester Road,Randolph,07869,Morris County,Randolph Township School District,2017
458,School #4,Public,K-5,279 Columbia Avenue,Cliffside Park,07010,Bergen County,Cliffside Park School District,2017
459,Franklin Elementary School,Public,"PK, KG-4",1000 Franklin Ave,South Plainfield,07080,Middlesex County,South Plainfield School District,2017
460,Learning Community Charter School,"Public, Charter","PK, KG-8",2495 John F Kennedy Blvd,Jersey City,07304,Hudson County,The Learning Community Charter School,2017
461,Virgil I. Grissom Elementary School,Public,K-5,One Sims Avenue,Old Bridge,08857,Middlesex County,Old Bridge Township School District,2017
462,Valley View School,Public,"PK, KG-4",400 Route 513,Califon,07830,Hunterdon County,Lebanon Township School District,2017
463,Belleville PS10,Public,"PK, KG-6",527 Belleville Ave,Belleville,07109,Essex County,Belleville Public School District,2017
464,C. Richard Applegate School,Public,K-5,47 Jeanne Brennan Drive,Freehold,07728,Monmouth County,Freehold Township School District,2017
465,Walter C. Black Elementary School,Public,K-2,371 Stockton Street,Hightstown,08520,Mercer County,East Windsor Regional School District,2017
466,Bloomsbury Borough School,Public,"PK, KG-8",20 Main Street,Bloomsbury,08804,Hunterdon County,Bloomsbury Borough School District,2017
467,John Hill School,Public,3-8,435 Lathrop Avenue,Boonton,07005,Morris County,Boonton Town Public School District,2017
468,Pace Charter School of Hamilton,"Public, Charter",K-8,1949 Hamilton Avenue,Hamilton,08619,Mercer County,Pace Charter School of Hamilton,2017
469,Sylvia Rosenauer Elementary School,Public,"PK, KG-5",60 Citadel Drive,Jackson,08527,Ocean County,Jackson Township School District,2017
470,Columbus School,Public,K-5,370 Westervelt Place,Lodi,07644,Bergen County,Lodi School District,2017
471,Mercerville Elementary School,Public,K-5,60 Regina Avenue,Hamilton,08619,Mercer County,Hamilton Township Public School District,2017
472,Connecticut Farms Elementary,Public,"PK, KG-5",875 Stuyvesant Avenue,Union,07083,Union County,Township of Union School District,2017
473,Midstreams Elementary School,Public,K-5,500 Midstreams Rd,Brick,08724,Ocean County,Brick Township Public School District,2017
474,Clinton Public School,Public,"PK, KG-8",10 School Street,Clinton,08809,Hunterdon County,Clinton-Glen Gardner School District,2017
475,Soaring Heights Charter School,"Public, Charter",K-8,1 Romar Avenue,Jersey City,07305,Hudson County,Soaring Heights Charter School,2017
476,Robert B Jaggard School,Public,K-5,2 Westcott Road,Marlton,08053,Burlington County,Evesham Township School District,2017
477,Canfield Avenue School,Public,"PK, KG-6",42 Canfield Avenue,Mine Hill,07803,Morris County,Mine Hill Township School District,2017
478,Fairview Elementary School,Public,"PK, KG-5",230 Cooper Road,Red Bank,07701,Monmouth County,Middletown Township Public School District,2017
479,Frederic N. Brown Elementary School,Public,K-4,125 Grove Ave,Verona,07044,Essex County,Verona Public School District,2017
480,Taylor Mills School,Public,K-6,77 Gordons Corner Road,Manalapan,07726,Monmouth County,Manalapan-Englishtown Regional School District,2017
481,Honiss Elementary/Middle School,Public,K-8,31 Depew St,Dumont,07628,Bergen County,Dumont Public School District,2017
482,Lafayette Elementary School,Public,K-5,100 Laauwe Avenue,Wayne,07470,Passaic County,Wayne Township Public School District,2017
483,Highland Elementary School,Public,3-6,31 Highland Ave,Midland Park,07432,Bergen County,Midland Park School District,2017
484,Englewood on the Palisades Charter School,"Public, Charter",K-8,65  West Demarest Avenue,Englewood,07631,Bergen County,Englewood on the Palisades Charter School,2017
485,Nixon Elementary School,Public,K-4,275 Mt  Arlington Boulevard,Landing,07850,Morris County,Roxbury Township School District,2017
486,Thomas Paine Elementary School,Public,K-5,4001 Church Rd.,Cherry Hill,08034,Camden County,Cherry Hill School District,2017
487,Northeast Elementary School,Public,K-5,603 Grove St,Upper Montclair,07042,Essex County,Montclair Public School District,2017
488,Lillian M. Steen,Public,"PK, KG-5",134 W. Main,Bogota,07603,Bergen County,Bogota Public School District,2017
489,Lebanon Borough School,Public,"PK, KG-6",6 Maple St,Lebanon,08833,Hunterdon County,Lebanon Borough School District,2017
490,Fernbrook School,Public,K-5,206 Quaker Church Road,Randolph,07869,Morris County,Randolph Township School District,2017
491,Hazel Avenue Elementary School,Public,K-5,45 Hazel Ave,West Orange,07052,Essex County,West Orange Public Schools,2017
492,Frankford Township School,Public,"PK, KG-8",4 Pines Road,Branchville,07826,Sussex County,Frankford Township Consolidated School District,2017
493,Countryside Elementary School,Public,"PK, KG-4",115 Schoolhouse Lane,Mount Laurel,08054,Burlington County,Mount Laurel Township School District,2017
494,Harmony Elementary School,Public,"PK, KG-5",100 Murphy Road,New Monmouth,07748,Monmouth County,Middletown Township Public School District,2017
495,Memorial Elementary School,Public,3-5,485 Adelphia Road,Freehold,07728,Monmouth County,Howell Township Public School District,2017
496,John A. Forrest Elementary School,Public,K-4,10 - 00 Hopper Ave,Fair Lawn,07410,Bergen County,Fair Lawn Public School District,2017
497,Bradley Gardens Primary School,Public,"PK, KG-4",148 Pine Street,Bridgewater,08807,Somerset County,Bridgewater-Raritan Regional School District,2017
498,Laura Donovan School,Public,K-5,237 Stonehurst Blvd,Freehold,07728,Monmouth County,Freehold Township School District,2017
499,Stephen J. Gerace School,Public,K-5,59 Boulevard,Pequannock,07440,Morris County,Pequannock Township School District,2017
500,School #9,Public,"PK, KG-5",25 Brighton Road,Clifton,07012,Passaic County,Clifton Public School District,2017
501,Lenox School,Public,K-5,35 Lenox Avenue,Pompton Lakes,07442,Passaic County,Pompton Lakes School District,2017
502,School #8,Public,"PK, KG-5",41 Oak Street,Clifton,07014,Passaic County,Clifton Public School District,2017
503,Greenwich School,Public,"PK, KG-5",101 Wyndham Farm Boulevard,Stewartsville,08886,Warren County,Greenwich Township School District,2017
504,Central Avenue School,Public,"PK, KG-5",50 Central Avenue,Madison,07940,Morris County,Madison Public School District,2017
505,Bertrand F. Gibbs Elementary School,Public,K-5,195 Sutton Place,New Milford,07646,Bergen County,New Milford Public School District,2017
506,Ardena Elementary School,Public,3-5,355 Adelphia Road,Farmingdale,07727,Monmouth County,Howell Township Public School District,2017
507,Pines Lake Elementary School,Public,K-5,511 Pines Lake Drive,Wayne,07470,Passaic County,Wayne Township Public School District,2017
508,Woodcrest Elementary School,Public,K-5,400 Cranford Dr.,Cherry Hill,08003,Camden County,Cherry Hill School District,2017
509,Central Elementary School,Public,K-5,2007 Allenwood Road,Wall,07719,Monmouth County,Wall Township Public School District,2017
510,E Raymond Appleby Elementary School,Public,2-5,23 Vliet Street,Spotswood,08884,Middlesex County,Spotswood Public School District,2017
511,Thomas Jefferson School,Public,3-5,James Street & Ogden Place,Morristown,07960,Morris County,Morris School District,2017
512,Benjamin Franklin Elementary School,Public,K-5,2485 Woodbridge Avenue,Edison,08817,Middlesex County,Edison Township School District,2017
513,Peter Muschal Elementary,Public,"PK, KG-5",323 Ward Ave,Bordentown,08505,Burlington County,Bordentown Regional School District,2017
514,Morgan Elementary School,Public,"PK, KG-5",38 Stamford Road,Hamilton,08619,Mercer County,Hamilton Township Public School District,2017
515,Westbrook Elementary School,Public,K-5,55 Nosenzo Pond Road,West Milford,07480,Passaic County,West Milford Township Public School District,2017
516,Hillside Elementary School,Public,3-5,54 Orange Rd,Montclair,07042,Essex County,Montclair Public School District,2017
517,Washington School,Public,K-6,155 Washington Ave,Nutley,07110,Essex County,Nutley Public School District,2017
518,Franklin Township School,Public,"PK, KG-6",52 Asbury  Broadway Road,Washington,07882,Warren County,Franklin Township School District,2017
519,Southwood Elementary School,Public,K-5,64 Southwood Dr,Old Bridge,08857,Middlesex County,Old Bridge Township School District,2017
520,Mannington Township Elementary School,Public,"PK, KG-8",495 Route 45,Salem,08079,Salem County,Mannington Township School District,2017
521,Byram Lakes Elementary School,Public,"PK, KG-4",11 Mansfield Drive,Stanhope,07874,Sussex County,Byram Township School District,2017
522,Whitehall Elementary School,Public,"PK, KG-4",161 Whitehall Rd,Williamstown,08094,Gloucester County,Monroe Township Public School District,2017
523,Kresson School,Public,K-5,7 School Lane,Voorhees,08043,Camden County,Voorhees Township School District,2017
524,Greenbrook Elementary School,Public,K-5,23 Roberts Street,Kendall Park,08824,Middlesex County,South Brunswick School District,2017
525,Springfield Township School,Public,"PK, KG-6",2146 Jacksonville Road,Jobstown,08041,Burlington County,Springfield Township School District,2017
526,Richard L Rice School,Public,"PK, KG-5",50 Crown Royal Parkway,Marlton,08053,Burlington County,Evesham Township School District,2017
527,Howard C. Johnson Elementary School,Public,"PK, KG-5",1021 Larsen Road,Jackson,08527,Ocean County,Jackson Township School District,2017
528,Mount Arlington Public School,Public,3-8,235 Howard Boulevard,Mount Arlington,07856,Morris County,Mount Arlington Public School District,2017
529,Euclid Elementary School,Public,"PK, KG-5",1 Burton Avenue,Hasbrouck Heights,07604,Bergen County,Hasbrouck Heights School District,2017
530,Bergen Arts and Sciences Charter School,"Public, Charter, Alternative",K-12,200 MacArthur Avenue,Garfield,07026,Bergen County,Bergen Arts and Science Charter School,2017
531,Samuel R. Donald Elementary School,Public,2-4,29 Captolene Avenue,Bloomingdale,07403,Passaic County,Bloomingdale School District,2017
532,Parker Elementary School,Public,K-3,South Lincoln Avenue,Middlesex,08846,Middlesex County,Middlesex Borough School District,2017
533,John F. Kennedy Elementary School,Public,K-5,1310 Ratzer Road,Wayne,07470,Passaic County,Wayne Township Public School District,2017
534,Emma Arleth Elementary School,Public,K-3,3198 Washington Road,Parlin,08859,Middlesex County,Sayreville School District,2017
535,Patrick McGaheran,Public,"PK, KG-2",63  Allerton Road,Lebanon,08833,Hunterdon County,Clinton Township School District,2017
536,South Harrison Elementary School,Public,"PK, KG-6",904 Mullica Hill Rd,Harrisonville,08039,Gloucester County,South Harrison Township School District,2017
537,White Rock Elementary School,Public,2-5,2 Francine Place,Oak Ridge,07438,Morris County,Jefferson Township Public School District,2017
538,Florence V Evans,Public,1-5,400 South Route 73,Marlton,08053,Burlington County,Evesham Township School District,2017
539,William A. Miller Elementary School,Public,K-5,2 Old Matawan Road,Old Bridge,08857,Middlesex County,Old Bridge Township School District,2017
540,Hatchery Hill Elementary School,Public,"PK, KG-1",398 5th Avenue,Hackettstown,07840,Warren County,Hackettstown Public School District,2017
541,Ocean Road Elementary School,Public,"PK, KG-5",Benedict Street,Point Pleasant Beach,08742,Ocean County,Point Pleasant Borough School District,2017
542,Franklin Elementary,Public,"PK, KG-4",1500 Lindy Terrace,Union,07083,Union County,Township of Union School District,2017
543,Dr. Michael Conti School,Public,"PK, KG-8",182 Merseles St,Jersey City,07302,Hudson County,Jersey City Public Schools,2017
544,Mary S. Shoemaker School,Public,1-5,201 E  Millbrooke Ave,Woodstown,08098,Salem County,Woodstown-Pilesgrove Regional School District,2017
545,Jotham W. Wakeman School,Public,"PK, KG-5",100 St Pauls Ave,Jersey City,07306,Hudson County,Jersey City Public Schools,2017
546,Delaware Township School,Public,"PK, KG-8",501 Rosemont  Ringoes Road,Sergeantsville,08557,Hunterdon County,Delaware Township School District,2017
547,Memorial Elementary School,Public,"PK, KG-4",201 Squaw Brook Rd.,North Haledon,07508,Passaic County,North Haledon School District,2017
548,Swimming River School,Public,3-5,220 Hance Avenue,Tinton Falls,07724,Monmouth County,Tinton Falls School District,2017
549,Memorial School,Public,"PK, KG-8",Memorial School,South Hackensack,07606,Bergen County,South Hackensack School District,2017
550,Frelinghuysen Township Elementary School,Public,"PK, KG-6",780 Route 94,Newton,07860,Warren County,Frelinghuysen Township School District,2017
551,Newell Elementary School,Public,"PK, KG-4",27 High Street,Allentown,08501,Monmouth County,Upper Freehold Regional School District,2017
552,Bartle Elementary School,Public,2-5,435 Mansfield Street,Highland Park,08904,Middlesex County,Highland Park Boro School District,2017
553,Hoover Elementary School,Public,"PK, KG-5",273 Murray Hill Terrace,Bergenfield,07621,Bergen County,Bergenfield Borough School District,2017
554,Washington Street Elementary School,Public,K-5,500 West Earl Court,Toms River,08753,Ocean County,Toms River Regional School District,2017
555,Frank K. Hehnly,Public,K-5,590 Raritan Road,Clark,07066,Union County,Clark Township Public School District,2017
556,Kennedy Elementary School,Public,K-4,20 Pleasant Hill Road,Succasunna,07876,Morris County,Roxbury Township School District,2017
557,Atlantic Avenue,Public,"PK, KG-2",21 East Atlantic Avenue,Haddon Heights,08035,Camden County,HADDON HEIGHTS School District,2017
558,Bee Meadow School,Public,K-5,120 Reynolds Avenue,Whippany,07981,Morris County,Hanover Township School District,2017
559,Normandy Park School,Public,K-5,19a Normandy Parkway,Morristown,07960,Morris County,Morris School District,2017
560,Marshall Hill Elementary School,Public,K-5,210 Marshall Hill Road,West Milford,07480,Passaic County,West Milford Township Public School District,2017
561,School 19,Public,K-4,31 James Street,Paterson,07502,Passaic County,Paterson Public School District,2017
562,Dennis Township Primary School,Public,"PK, KG-2",601 Hagan Road,Cape May Court House,08210,Cape May County,Dennis Township School District,2017
563,Alexander Elementary School,Public,K-5,20 Robert Frost Drive,Hamilton,08690,Mercer County,Hamilton Township Public School District,2017
564,Stoy Elementary School,Public,"PK, KG-5",206 Briarwood Avenue,Haddonfield,08033,Camden County,Haddon Township School District,2017
565,Lynn Crest Elementary School,Public,"PK, KG-5",98 Ira Avenue,Colonia,07067,Middlesex County,Woodbridge Township School District,2017
566,School #5,Public,"PK, KG-4",214 Day Ave,Cliffside Park,07010,Bergen County,Cliffside Park School District,2017
567,High Bridge Elementary School,Public,"PK, KG-4",40 Fairview Avenue,High Bridge,08829,Hunterdon County,High Bridge Borough School District,2017
568,Gloucester Township Elementary School,Public,K-5,270 South Black Horse Pike,Blackwood,08012,Camden County,Gloucester Township Public Schools,2017
569,Harry S. Truman Elementary School,Public,K-3,One Taft Place,Parlin,08859,Middlesex County,Sayreville School District,2017
570,Huber Street School,Public,"PK, KG-5",1520 Paterson Plank Rd,Secaucus,07094,Hudson County,Secaucus School District,2017
571,Knollwood Elementary School,Public,K-3,333 Willow Avenue,Piscataway,08854,Middlesex County,Piscataway Township School District,2017
572,Raritan Valley School,Public,1-4,37 Cresci Blvd,Hazlet,07730,Monmouth County,Hazlet Township Public School District,2017
573,Theodore Roosevelt School,Public,3-6,1 Louisa Place,Weehawken,07086,Hudson County,Weehawken Public School District,2017
574,Alfred Zampella School,Public,"PK, KG-8",201 North St,Jersey City,07307,Hudson County,Jersey City Public Schools,2017
575,Whiton Elementary School,Public,"PK, KG-3",470 Whiton Road,Neshanic Station,08853,Somerset County,Branchburg Township School District,2017
576,Environment Community Opportunity (ECO) Charter School,"Public, Charter",K-8,817 Carpenter Street,Camden,08102,Camden County,Environment Community Opportunity (ECO) Charter School,2017
577,Memorial School,Public,"PK, KG-8",221 Morningside Avenue,Union Beach,07735,Monmouth County,Union Beach Public School District,2017
578,Millstone Township Elementary School,Public,3-5,308 Millstone Road,Clarksburg,08510,Monmouth County,Millstone Township School District,2017
579,Van Sciver Elementary School,Public,"PK, KG-5",625 Rhoads Avenue,Haddonfield,08033,Camden County,Haddon Township School District,2017
580,General Charles G. Harker School,Public,3-5,1771 Oldmans Creek Road,Woolwich Township,08085,Gloucester County,Swedesboro-Woolwich School District,2017
