rank,school,type,grades,address,city,zip,county,district,year
581,Gantner Avenue School,Public,K-5,99 Roosevelt Ave,Elmwood Park,07407,Bergen County,Elmwood Park School District,2017
582,Hainesport Township School,Public,"PK, KG-8",211 Broad Street,Hainesport,08036,Burlington County,Hainesport Township School District,2017
583,Manasquan Elementary School,Public,"PK, KG-8",168 Broad Street,Manasquan,08736,Monmouth County,Manasquan School District,2017
584,Robert Mascenik Elementary School,Public,K-5,300 Benjamin Avenue,Iselin,08830,Middlesex County,Woodbridge Township School District,2017
585,Clementon Elementary School,Public,"PK, KG-8",4 Audubon Ave,Clementon,08021,Camden County,Clementon Elementary School District,2017
586,Upper Pittsgrove School,Public,"PK, KG-8",235 Pine Tavern Road,Monroeville,08343,Salem County,UPPER PITTSGROVE Township School District,2017
587,Woodrow Wilson School #5,Public,"PK, KG-5",205 Outwater Lane,Garfield,07026,Bergen County,Garfield Public School District,2017
588,School #2,Public,K-5,1270 Van Houten Avenue,Clifton,07013,Passaic County,Clifton Public School District,2017
589,Madison Park Elementary School,Public,K-5,33 Harvard Rd,Parlin,08859,Middlesex County,Old Bridge Township School District,2017
590,School #3,Public,K-5,365 Washington Avenue,Clifton,07011,Passaic County,Clifton Public School District,2017
591,Clara Barton Elementary School,Public,K-5,223 Rhode Island Ave.,Cherry Hill,08034,Camden County,Cherry Hill School District,2017
592,Wayside Elementary School,Public,"PK, KG-4",733 Bowne Road,Ocean,07712,Monmouth County,Township of Ocean School District,2017
593,Middle Road School,Public,1-4,305 Middle Road,Hazlet,07730,Monmouth County,Hazlet Township Public School District,2017
594,Eleanor Van Gelder,Public,3-6,251 Undercliff Ave,Edgewater,07020,Bergen County,Edgewater School District,2017
595,Alexander Hamilton Academy,Public,K-8,11  27 16th Avenue,Paterson,07501,Passaic County,Paterson Public School District,2017
596,Clara Barton Elementary,Public,K-2,100 Crosswicks St,Bordentown,08505,Burlington County,Bordentown Regional School District,2017
597,Lester D. Wilson Elementary School,Public,"PK, KG-3",525 County Road 513,Pittstown,08867,Hunterdon County,Alexandria Township School District,2017
598,Washington Elementary School,Public,K-5,176 Mohawk Avenue,Hawthorne,07506,Passaic County,Hawthorne Public School District,2017
599,J Harold Van Zant,Public,K-5,270 Conestoga Drive,Marlton,08053,Burlington County,Evesham Township School District,2017
600,Cecil S. Collins Elementary,Public,K-2,570 Barnegat Blvd  North,Barnegat,08005,Ocean County,Barnegat Township School District,2017
601,Hazelwood Elementary School,Public,"PK, KG-3",800 Hazelwood Avenue,Middlesex,08846,Middlesex County,Middlesex Borough School District,2017
602,Lillian Drive School,Public,1-4,28 Lillian Drive,Hazlet,07730,Monmouth County,Hazlet Township Public School District,2017
603,Franklin Township School,Public,"PK, KG-8",226 Quakertown Road,Quakertown,08868,Hunterdon County,Franklin Township School District,2017
604,Winslow Township Elementary School Four,Public,"PK, KG-3",541 Kali Road,Sicklerville,08081,Camden County,Winslow Township School District,2017
605,Ogdensburg Borough School,Public,"PK, KG-8",100 Main Street,Ogdensburg,07439,Sussex County,Ogdensburg Borough School District,2017
606,Francis A. Desmares Elementary School,Public,K-4,16 Old Clinton Road,Flemington,08822,Hunterdon County,Flemington-Raritan Regional School District,2017
607,Rolling Hills Primary School,Public,2-3,60 Sammis Road,Vernon,07462,Sussex County,Vernon Township School District,2017
608,Ocean Avenue Elementary School,Public,"PK, KG-5",235 Ocean Avenue,North Middletown,07748,Monmouth County,Middletown Township Public School District,2017
609,New Monmouth Elementary School,Public,K-5,121 New Monmouth Road,Middletown,07748,Monmouth County,Middletown Township Public School District,2017
610,Frank W. Gavlak Elementary School,Public,K-6,106 King St,Wallington,07057,Bergen County,Wallington Boro School District,2017
611,Edgemont Elementary School,Public,K-5,20 Edgemont Rd,Montclair,07042,Essex County,Montclair Public School District,2017
612,Forked River Elementary School,Public,K-4,110 Lacey Road,Forked River,08731,Ocean County,Lacey Township School District,2017
613,Frances DeMasi Elementary School,Public,K-5,199 Evesboro  Medford Rd,Marlton,08053,Burlington County,Evesham Township School District,2017
614,Hillside Elementary School,Public,"PK, KG-4",1370 Hainesport Mt Laurel Rd,Mount Laurel,08054,Burlington County,Mount Laurel Township School District,2017
615,Elwood Kindle Elementary School,Public,2-5,211 Washington Avenue,Pitman,08071,Gloucester County,Pitman Boro School District,2017
616,Florence M. Burd,Public,"PK, KG-4",219 Newton Sparta Road,Newton,07860,Sussex County,Andover Regional School District,2017
617,Ocean City Primary School,Public,"PK, KG-3",550 West Avenue,Ocean City,08226,Cape May County,Ocean City School District,2017
618,Kingston Elementary School,Public,K-5,320 Kingston Rd.,Cherry Hill,08034,Camden County,Cherry Hill School District,2017
619,Parkway Elementary School,Public,"PK, KG-4",142 Ramblewood Parkway,Mount Laurel,08054,Burlington County,Mount Laurel Township School District,2017
620,James Russell Lowell Elementary School,Public,K-4,1025 Lincoln Place,Teaneck,07666,Bergen County,Teaneck School District,2017
621,Ann Street School,Public,K-8,30 Ann St,Newark,07105,Essex County,Newark Public School District,2017
622,Washington School,Public,1-3,89 Wood St,Rutherford,07070,Bergen County,Rutherford School District,2017
623,Lincoln,Public,"PK, KG-8",400 Second Avenue,Garwood,07027,Union County,Garwood Boro,2017
624,Elsinboro Township School,Public,K-8,631 Salem  Fort Elfsborg Road,Salem,08079,Salem County,Elsinboro Township School District,2017
625,Raymond E. Voorhees Elementary School,Public,K-5,11 Liberty Street,Old Bridge,08857,Middlesex County,Old Bridge Township School District,2017
626,Radix Elementary,Public,"PK, KG-4",363 Radix Rd,Williamstown,08094,Gloucester County,Monroe Township Public School District,2017
627,Belleville PS9,Public,K-6,301 Ralph St,Belleville,07109,Essex County,Belleville Public School District,2017
628,Hope Township School,Public,"PK, KG-8",320 Johnsonburg Road,Hope,07844,Warren County,Hope Township School District,2017
629,Mary Bray Elementary School,Public,"PK, KG-5",225 West Kings Highway,Mount Ephraim,08059,Camden County,Mt. Ephraim School District,2017
630,Upper Greenwood Lake Elementary School,Public,K-5,41 Henry Road,Hewitt,07421,Passaic County,West Milford Township Public School District,2017
631,Salem Drive School,Public,K-5,29 Salem Drive,Whippany,07981,Morris County,Hanover Township School District,2017
632,Clarendon School,Public,K-5,685 Fifth St,Secaucus,07094,Hudson County,Secaucus School District,2017
633,Nathaniel Hawthorne Elementary School,Public,K-4,201 Fycke Lane,Teaneck,07666,Bergen County,Teaneck School District,2017
634,Franklin Elementary School,Public,K-6,85 Curtis Street,Bloomfield,07003,Essex County,Bloomfield Township School District,2017
635,The Ethical Community Charter School,"Public, Charter",K-8,95 Broadway,Jersey City,07306,Hudson County,The Ethical Community Charter School,2017
636,Northfield Community Elementary School,Public,"PK, KG-4",2000 New Road,Northfield,08225,Atlantic County,Northfield City School District,2017
637,Dr. Paul Rafalides School,Public,"PK, KG-4",362 Union St,Jersey City,07304,Hudson County,Jersey City Public Schools,2017
638,Greenwood Elementary School,Public,"PK, KG-5",2069 Greenwood Avenue,Hamilton,08609,Mercer County,Hamilton Township Public School District,2017
639,Eleanor Rush Intermediate School,Public,3-5,1200 Wynwood Drive,Cinnaminson,08077,Burlington County,Cinnaminson Township School District,2017
640,Netcong Elementary School,Public,"PK, KG-8",26 College Road,Netcong,07857,Morris County,Netcong School District,2017
641,White Township Consolidated School,Public,"PK, KG-8",565 Cr 519,Belvidere,07823,Warren County,White Township Consolidated School District,2017
642,Robert L. Craig School,Public,"PK, KG-8",20 West Park Street,Moonachie,07074,Bergen County,Moonachie School District,2017
643,Johnnie L. Cochran Junior Academy,Public,K-5,190 Midland Avenue,East Orange,07017,Essex County,East Orange School District,2017
644,Kingwood Township School,Public,"PK, KG-8",880 County Road 519,Frenchtown,08825,Hunterdon County,Kingwood Township School District,2017
645,Conerly Road School,Public,"PK, KG-5",35 Conerly Road,Somerset,08873,Somerset County,Franklin Township Public School District,2017
646,Helen I. Smith School,Public,K-6,30 Cambridge Avenue,Saddle Brook,07663,Bergen County,Saddle Brook School District,2017
647,Osbornville Elementary School,Public,K-5,218 Drum Point Rd,Brick,08723,Ocean County,Brick Township Public School District,2017
648,Woodbury Heights Elementary,Public,"PK, KG-6",100 Academy Ave,Woodbury Hts,08097,Gloucester County,Woodbury Heights Public School District,2017
649,Milford Public School,Public,"PK, KG-5",7 Hillside Avenue,Milford,08848,Hunterdon County,Milford Borough School District,2017
650,McGalliard Elementary School,Public,K-5,1600 Arena Drive,Hamilton,08610,Mercer County,Hamilton Township Public School District,2017
651,Arthur Rann Elementary School,Public,K-6,515 S Eighth Ave,Galloway,08205,Atlantic County,Galloway Township Public School District,2017
652,South Amboy Elementary,Public,"PK, KG-5",249 John Street,South Amboy,08879,Middlesex County,South Amboy School District,2017
653,Paradise Knoll Elementary School,Public,K-5,103 Paradise Road,Oak Ridge,07438,Passaic County,West Milford Township Public School District,2017
654,Laurel Springs School,Public,"PK, KG-6",623 Grand Avenue,Laurel Springs,08021,Camden County,Laurel Springs School District,2017
655,Leroy Gordon Cooper Elementary School,Public,K-5,160 Birchwood Drive,Keyport,07735,Middlesex County,Old Bridge Township School District,2017
656,Fredon Township School,Public,"PK, KG-6",459 Route 94,Newton,07860,Sussex County,Fredon Township School District,2017
657,Washington Elementary School,Public,K-5,153 Winthrop Road,Edison,08817,Middlesex County,Edison Township School District,2017
658,Mansfield Township Elementary,Public,"PK, KG-6",50 Port Murray Road,Port Murray,07865,Warren County,Mansfield Township Elementary School District,2017
659,Livingston Elementary,Public,"PK, KG-4",960 Midland Blvd,Union,07083,Union County,Township of Union School District,2017
660,Silver Bay Elementary School,Public,"PK, KG-5",100 Silver Bay Road,Toms River,08753,Ocean County,Toms River Regional School District,2017
661,First Avenue School,Public,"PK, KG-8",214 First Ave,Newark,07107,Essex County,Newark Public School District,2017
662,Hurffville Elementary School,Public,K-5,200 Hurffville  Grenloch Rd,Sewell,08080,Gloucester County,Washington Township School District,2017
663,Joseph A. Citta Elementary School,Public,"PK, KG-5",2050 Lakewood Road,Toms River,08755,Ocean County,Toms River Regional School District,2017
664,Alloway Township School,Public,"PK, KG-8",43 Cedar St,Alloway,08001,Salem County,Alloway Township School District,2017
665,Indian Mills Elementary School,Public,"PK, KG-4",112 Indian Mills Road,Shamong,08088,Burlington County,Shamong Township School District,2017
666,Ridge and Valley Charter School,"Public, Charter",K-8,1234 State Route 94,Blairstown,07825,Warren County,Ridge and Valley Charter School,2017
667,School #1,Public,K-5,158 Park Slope,Clifton,07011,Passaic County,Clifton Public School District,2017
668,Number 10,Public,"PK, KG-5",2801 Highland Avenue,Linden,07036,Union County,Linden Public School District,2017
669,Holly Glen Elementary School,Public,"PK, KG-4",900 North Main Street,Williamstown,08094,Gloucester County,Monroe Township Public School District,2017
670,Valley Road School,Public,"PK, KG-8",24 Valley Road,Stanhope,07874,Sussex County,Stanhope School District,2017
671,Walter F. Robinson Community School,Public,"PK, KG-8",95 West 31st Street,Bayonne,07002,Hudson County,Bayonne School District,2017
672,Mark Newbie Elementary School,Public,K-5,2 East Browning Rd,Collingswood,08108,Camden County,Collingswood Public School District,2017
673,Hooper Avenue Elementary School,Public,K-5,1517  Hooper Avenue,Toms River,08753,Ocean County,Toms River Regional School District,2017
674,Herbertsville Early Childhood Development Center,Public,PK,2282 Lanes Mill Rd,Brick,08724,Ocean County,Brick Township Public School District,2017
675,Maple Road Elementary School,Public,"PK, KG-5",36 Maple Road,West Milford,07480,Passaic County,West Milford Township Public School District,2017
676,Katharine D Malone Elementary School,Public,K-5,524 Green Pond Road,Rockaway,07866,Morris County,Rockaway Township School District,2017
677,Stow Creek Township School,Public,"PK, KG-8",11 Gum Tree Corner Road,Bridgeton,08323,Cumberland County,Stow Creek Township School District,2017
678,Dwight D. Eisenhower Elementary School,Public,K-3,601 Ernston Road,Parlin,08859,Middlesex County,Sayreville School District,2017
679,Manchester Township Elementary School,Public,K-5,101 N  Colonial Drive,Manchester,08733,Ocean County,Manchester Township School District,2017
680,Midland School #1,Public,"PK, KG-8",300 Rochelle Ave,Rochelle Park,07662,Bergen County,Rochelle Park School District,2017
681,Farmingdale Elementary,Public,"PK, KG-8",49 Academy St,Farmingdale,07727,Monmouth County,Farmingdale Public School District,2017
682,Kelly Elementary School,Public,K-5,555 Pleasant Valley Way,West Orange,07052,Essex County,West Orange Public Schools,2017
683,East Dover Elementary School,Public,K-6,300 East McFarlan Street,Dover,07801,Morris County,Dover Public School District,2017
684,Livingston Park,Public,"PK, KG-4",1128 Livingston Avenue,North Brunswick,08902,Middlesex County,North Brunswick Township School District,2017
685,Crawford-Rodriguez Elementary School,Public,"PK, KG-5",1025 Larsen Road,Jackson,08527,Ocean County,Jackson Township School District,2017
686,Harrison Township Elementary School,Public,"PK, KG-3",120 N Main Street,Mullica Hill,08062,Gloucester County,Harrison Township School District,2017
687,Lafayette Street School,Public,"PK, KG-8",205 Lafayette St,Newark,07105,Essex County,Newark Public School District,2017
688,Mullica Township Primary School,Public,"PK, KG-4",500 Elwood Road,Elwood,08217,Atlantic County,Mullica Township School District,2017
689,Thomas A. Edison Elementary School,Public,"PK, KG-5",205 Melrose Avenue,Westmont,08108,Camden County,Haddon Township School District,2017
690,Sandyston Walpack Consolidated School,Public,K-6,100 Route 560,Layton,07851,Sussex County,Sandyston-Walpack Consolidated School District,2017
691,Holland Township Elementary School,Public,"PK, KG-8",710 Milford  Warren Glen Road,Milford,08848,Hunterdon County,Holland Township School District,2017
692,W.C.K. Walls Elementary,Public,2-5,320 Grant Avenue,Pitman,08071,Gloucester County,Pitman Boro School District,2017
693,Knowlton Township Board of Education,Public,"PK, KG-6",80 Route 46,Delaware,07833,Warren County,Knowlton Township School District,2017
694,John F Kennedy Elementary School,Public,"PK, KG-3",228 Mt Vernon Avenue,West Berlin,08091,Camden County,Berlin Township School District,2017
695,Marlton Elementary,Public,K-5,190 Tomlinson Mill Road,Marlton,08053,Burlington County,Evesham Township School District,2017
696,Merchantville Elementary School,Public,"PK, KG-8",130 S Centre St,Merchantville,08109,Camden County,Merchantville School District,2017
697,Victor Mravlag School No. 21,Public,"PK, KG-8",132 Shelley Avenue,Elizabeth,07208,Union County,Elizabeth Public Schools,2017
698,Unity Charter School,"Public, Charter",K-8,1 Evergreen Place,Morristown,07960,Morris County,Unity Charter School,2017
699,Birches Elementary School,Public,K-5,416 Westminster Blvd,Turnersville,08012,Gloucester County,Washington Township School District,2017
700,Ryerson Elementary School,Public,K-5,30 Mc Clelland Avenue,Wayne,07470,Passaic County,Wayne Township Public School District,2017
701,Larchmont Elementary School,Public,"PK, KG-4",301 Larchmont Blvd,Mount Laurel,08054,Burlington County,Mount Laurel Township School District,2017
702,Lanoka Harbor Elementary School,Public,K-4,281 Manchester Ave,Lanoka Harbor,08734,Ocean County,Lacey Township School District,2017
703,Tabernacle Elementary School,Public,"PK, KG-4",141 New Road,Tabernacle,08088,Burlington County,Tabernacle Township School District,2017
704,Union Valley Elementary School,Public,"PK, KG-5",1300 Jarvis Road,Sicklerville,08081,Camden County,Gloucester Township Public Schools,2017
705,Eldridge Park School,Public,K-3,55 Lawn Park Ave,Lawrenceville,08648,Mercer County,Lawrence Township Public School District,2017
706,Lincoln School,Public,K-6,301 Harrison St,Nutley,07110,Essex County,Nutley Public School District,2017
707,Cedar Grove Elementary School,Public,"PK, KG-5",179 Cedar Grove Road,Toms River,08753,Ocean County,Toms River Regional School District,2017
708,Ventnor Elementary School,Public,"PK, KG-4",400 N  Lafayette Avenue,Ventnor City,08406,Atlantic County,Ventnor City School District,2017
709,Hardyston Township Elementary School,Public,"PK, KG-4",50 Route 23,Franklin,07416,Sussex County,Hardyston Township School District,2017
710,Joyce Kilmer Elementary School,Public,K-5,2900 Chapel Ave.,Cherry Hill,08002,Camden County,Cherry Hill School District,2017
711,Cedar Mountain Primary School,Public,K-1,17 Sammis Road,Vernon,07462,Sussex County,Vernon Township School District,2017
712,Ethel McKnight Elementary School,Public,K-2,58 Twin Rivers Dr   South,East Windsor,08520,Mercer County,East Windsor Regional School District,2017
713,Highlands Elementary School,Public,"PK, KG-6",360 Navesink Avenue,Highlands,07732,Monmouth County,Highlands Borough School District,2017
714,School 1,Public,K-5,1 East 32nd Street,Paterson,07514,Passaic County,Paterson Public School District,2017
715,Clayton J. Davenport Elementary School,Public,K-3,2499 Spruce Avenue,Egg Harbor Township,08234,Atlantic County,Egg Harbor Township School District,2017
716,Switlik Elementary School,Public,"PK, KG-5",75 West Veterans Highway,Jackson,08527,Ocean County,Jackson Township School District,2017
717,Menlo Park Terrace Elementary School,Public,K-5,19 Maryknoll Road,Metuchen,08840,Middlesex County,Woodbridge Township School District,2017
718,Lambertville Public School,Public,"PK, KG-6",200 N. Main,Lambertville,08530,Hunterdon County,South Hunterdon Regional School District,2017
719,Woodbine Avenue Elementary School,Public,K-5,Woodbine Avenue,Avenel,07001,Middlesex County,Woodbridge Township School District,2017
720,Sherman Elementary School,Public,"PK, KG-5",375 E Grant Ave,Roselle Park,07204,Union County,Roselle Park Public School District,2017
721,West Dover Elementary School,Public,K-5,50 Blue Jay Drive,Toms River,08753,Ocean County,Toms River Regional School District,2017
722,Nicolaus Copernicus School,Public,"PK, KG-5",3385 Kennedy Blvd,Jersey City,07307,Hudson County,Jersey City Public Schools,2017
723,Academy Street Elementary School,Public,"PK, KG-6",14 Academy Street,Dover,07801,Morris County,Dover Public School District,2017
724,Number 2,Public,"PK, KG-5",1700 South Wood Avenue,Linden,07036,Union County,Linden Public School District,2017
725,Reeds Road Elementary School,Public,K-6,103 South Reeds Road,Galloway,08205,Atlantic County,Galloway Township Public School District,2017
726,McKenzie School,Public,"PK, KG-4",125 Carlton Avenue,East Rutherford,07073,Bergen County,East Rutherford School District,2017
727,J. Garfield Jackson Senior Academy,Public,"PK, KG-5",106 Prospect Street,East Orange,07017,Essex County,East Orange School District,2017
728,Wantage Elementary School,Public,3-5,815 Route 23,Sussex,07461,Sussex County,Sussex-Wantage Regional School District,2017
729,Alexander Hamilton,Public,3-5,24 Mills Street,Morristown,07960,Morris County,Morris School District,2017
730,Bayview Elementary School,Public,K-5,300 Leonardville Road,Belford,07718,Monmouth County,Middletown Township Public School District,2017
731,Blairstown Elementary School,Public,"PK, KG-6",1 Sunset Hill Road,Blairstown,07825,Warren County,Blairstown Elementary Township School District,2017
732,Ashbrook Elementary School,Public,"PK, KG-2",33 Municipal Drive,Lumberton,08048,Burlington County,Lumberton Township Board of Education,2017
733,Woodrow Wilson Community School,Public,"PK, KG-8",101 West 56th Street,Bayonne,07002,Hudson County,Bayonne School District,2017
734,Eagleswood Elementary School,Public,"PK, KG-6",511 Route 9,West Creek,08092,Ocean County,Eagleswood Township School District,2017
735,Berlin Community School,Public,"PK, KG-8",215 S Franklin Ave,Berlin,08009,Camden County,Berlin Borough School District,2017
736,Park Elementary School,Public,"PK, KG-8",120 Manchester Place,Newark,07104,Essex County,Newark Public School District,2017
737,Whiting Elementary School,Public,"PK, KG-5",412 Manchester Blvd,Whiting,08759,Ocean County,Manchester Township School District,2017
738,North Dover Elementary School,Public,"PK, KG-6",51 Highland Avenue,Dover,07801,Morris County,Dover Public School District,2017
739,Carteret Elementary School,Public,K-6,158 Grove Street,Bloomfield,07003,Essex County,Bloomfield Township School District,2017
740,Roland Rogers Elementary School,Public,"PK, KG-6",105 S  Reeds Road,Galloway,08205,Atlantic County,Galloway Township Public School District,2017
741,Parkview School,Public,"PK, KG-3",80 Violet Terrace,Milltown,08850,Middlesex County,Milltown School District,2017
742,Glendora Elementary School,Public,K-5,201 Station Ave,Glendora,08029,Camden County,Gloucester Township Public Schools,2017
743,Robert Fulton Elementary School,Public,1-8,7407 Hudson Ave,North Bergen,07047,Hudson County,North Bergen School District,2017
744,Wallace Elementary School,Public,"PK, KG-5",1100 Willow Avenue,Hoboken,07030,Hudson County,Hoboken Public School District,2017
745,Allamuchy Township School,Public,3-8,20 Johnsonburg Road,Allamuchy,07820,Warren County,Allamuchy Township School District,2017
746,Arthur M. Judd,Public,"PK, KG-4",1595 Roosevelt Avenue,North Brunswick,08902,Middlesex County,North Brunswick Township School District,2017
747,John M. Bailey Community School,Public,"PK, KG-8",75 West 10th Street,Bayonne,07002,Hudson County,Bayonne School District,2017
748,Margaret Mace Elementary School,Public,"PK, KG-8",1201 Atlantic Avenue,North Wildwood,08260,Cape May County,North Wildwood School District,2017
749,Number 9,Public,"PK, KG-5",1401 Deerfield Terrace,Linden,07036,Union County,Linden Public School District,2017
750,Philip's Academy Charter School,"Public, Charter","PK, KG-8",342 Central Avenue,Newark,07103,Essex County,Phillip's Academy Charter School,2017
751,Mill Lake,Public,"PK, KG-3",115 Monmouth Road,Monroe Twp,08831,Middlesex County,Monroe Township School District,2017
752,Mary J Donohoe Community School,Public,"PK, KG-8",38 Dodge Street,Bayonne,07002,Hudson County,Bayonne School District,2017
753,Martin Luther King Junior School,Public,"PK, KG-8",886 Bergen Ave,Jersey City,07306,Hudson County,Jersey City Public Schools,2017
754,Robinson Elementary School,Public,K-5,495 Gropp Avenue,Hamilton,08610,Mercer County,Hamilton Township Public School District,2017
755,Strawbridge Elementary School,Public,K-5,307 Strawbridge Avenue,Westmont,08108,Camden County,Haddon Township School District,2017
756,Fleetwood Elementary School,Public,"PK, KG-4",231 Fleetwood Ave,Mount Laurel,08054,Burlington County,Mount Laurel Township School District,2017
757,James Johnson Elementary School,Public,K-5,500 Kresson Rd.,Cherry Hill,08034,Camden County,Cherry Hill School District,2017
758,Seth Boyden Elementary Demonstration School,Public,K-5,274 Boyden Ave,Maplewood,07040,Essex County,South Orange-Maplewood School District,2017
759,Pauline J. Petway Elementary School,Public,K-5,1115 So  Lincoln Ave,Vineland,08361,Cumberland County,Vineland Public School District,2017
760,George Washington Elementary School,Public,"PK, KG-5",175 Albert Street,North Arlington,07031,Bergen County,North Arlington School District,2017
761,Union County TEAMS Charter School,"Public, Charter, Alternative",K-12,515  517 West Fourth Street,Plainfield,07060,Union County,Union County TEAMS Charter School-High School/College LA,2017
762,Cedar Creek Elementary School,Public,K-4,220 Western Blvd,Lanoka Harbor,08734,Ocean County,Lacey Township School District,2017
763,Memorial Elementary School,Public,"PK, KG-1",400 Hudson Avenue,Pitman,08071,Gloucester County,Pitman Boro School District,2017
764,Leonardo Elementary School,Public,K-5,14 Hosford Avenue,Leonardo,07737,Monmouth County,Middletown Township Public School District,2017
765,Sayen Elementary School,Public,K-5,3333 Nottingham Way,Hamilton,08690,Mercer County,Hamilton Township Public School District,2017
766,Island Heights Elementary School,Public,"PK, KG-6",115 Summit Ave,Island Heights,08732,Ocean County,Island Heights School District,2017
767,Carlstadt Public School,Public,"PK, KG-8",550 Washington Street,Carlstadt,07072,Bergen County,Carlstadt Public School District,2017
768,Arthur Stanlick Elementary School,Public,2-5,121 B  Shawnee Trail,Wharton,07885,Morris County,Jefferson Township Public School District,2017
769,Avon Elementary School,Public,"PK, KG-4",862 Mercer Dr,Haddonfield,08033,Camden County,Barrington School District,2017
770,A.E. Burling Elementary School,Public,"PK, KG-5",3600 Harris Avenue,Pennsauken,08105,Camden County,Pennsauken Township Board of Education School District,2017
771,Public School Number Two,Public,K-6,5200 Broadway,West New York,07093,Hudson County,West New York School District,2017
772,Bellmawr Park Elementary School,Public,"PK, KG-4",29 Peach Road,Bellmawr,08031,Camden County,Bellmawr Public School District,2017
