rank,school,type,grades,address,city,zip,county,district,year
773,Roosevelt Elementary School,Public,K-5,50 Roosevelt Avenue,Hawthorne,07506,Passaic County,Hawthorne Public School District,2017
774,Horace Mann Elementary School,Public,1-8,1215  83rd Street,North Bergen,07047,Hudson County,North Bergen School District,2017
775,John H. Winslow Elementary School,Public,K-5,1335 Magnolia Rd,Vineland,08360,Cumberland County,Vineland Public School District,2017
776,John P. Holland Charter School,"Public, Charter","PK, KG-8",5 Garret Mountain Plaza,Woodland Park,07424,Passaic County,John P Holland Charter School,2017
777,Warren E. Sooy Junior Elementary School,Public,2-5,601 N  Fourth Street,Hammonton,08037,Atlantic County,Hammonton School District,2017
778,Hampton Borough School,Public,"PK, KG-5",32  41 South Street,Hampton,08827,Hunterdon County,Hampton Borough School District,2017
779,Clarence B. Lamb Elementary School,Public,"PK, KG-4",46 Schoolhouse Road,Wrightstown,08562,Burlington County,North Hanover Township School District,2017
780,Veterans Memorial Elementary School,Public,K-5,103 Hendrickson Avenue,Brick,08724,Ocean County,Brick Township Public School District,2017
781,Hannah Caldwell Elementary,Public,"PK, KG-4",1120 Commerce Avenue,Union,07083,Union County,Township of Union School District,2017
782,George J. Mitchell Elementary School,Public,K-2,950 Route 539,Little Egg Harbor,08087,Ocean County,Little Egg Harbor Township School District,2017
783,Oxford Central School,Public,"PK, KG-8",17 Kent Street,Oxford,07863,Warren County,Oxford Township School District,2017
784,Lake Tract Elementary School,Public,2-6,690 Iszard Rd,Deptford,08096,Gloucester County,Deptford Township Public School District,2017
785,Quinton Township School,Public,"PK, KG-8",8 Robinson Street,Quinton,08072,Salem County,Quinton Township School District,2017
786,Neeta School,Public,3-8,44 Neeta Trail,Medford Lakes,08055,Burlington County,Medford Lakes School District,2017
787,Franklin School,Public,K-6,95 Caldwell Avenue,Saddle Brook,07663,Bergen County,Saddle Brook School District,2017
788,John P. Faber Elementary School,Public,"PK, KG-5",400 High Street,Dunellen,08812,Middlesex County,Dunellen Public School District,2017
789,Lafayette Township School,Public,"PK, KG-8",178 Beaver Run Road,Lafayette,07848,Sussex County,Lafayette Township School District,2017
790,Walnut Street School,Public,"PK, KG-5",60 Walnut Street,Woodbury,08096,Gloucester County,Woodbury City Public School District,2017
791,Mansion Avenue School,Public,3-6,300 Mansion Avenue,Audubon,08106,Camden County,Audubon Public School District,2017
792,Woodmere,Public,2-4,65 Raleigh Court,Eatontown,07724,Monmouth County,Eatontown Public School District,2017
793,Dr. Orlando Edreira Academy School No. 26,Public,"PK, KG-8",1014 South Elmora Avenue,Elizabeth,07202,Union County,Elizabeth Public Schools,2017
794,Oak Ridge Heights Elementary School,Public,K-5,720 Inman Avenue,Colonia,07067,Middlesex County,Woodbridge Township School District,2017
795,Oliver Street School,Public,"PK, KG-8",86 Oliver St,Newark,07105,Essex County,Newark Public School District,2017
796,Christa McAuliffe School,Public,"PK, KG-8",167 Hancock Ave,Jersey City,07307,Hudson County,Jersey City Public Schools,2017
797,James Madison School #10,Public,"PK, KG-5",55 Lincoln Place,Garfield,07026,Bergen County,Garfield Public School District,2017
798,Oak Valley Elementary School,Public,2-6,525 College Blvd,Wenonah,08090,Gloucester County,Deptford Township Public School District,2017
799,BelovED Community Charter School,"Public, Charter, Alternative",K-11,508 Grand Street,Jersey City,07302,Hudson County,BelovED Community Charter School,2017
800,Swift-Slaybaugh Complex,Public,"PK, KG-3",11 Swift Avenue,Egg Harbor Township,08234,Atlantic County,Egg Harbor Township School District,2017
801,The Queen City Academy Charter School,"Public, Charter, Alternative",K-12,815 West Seventh Street,Plainfield,07063,Union County,The Queen City Academy Charter School District,2017
802,Madison Elementary School,Public,"PK, KG-6",944 Madison Avenue,Rahway,07065,Union County,Rahway Public School District,2017
803,Aura Elementary School,Public,"PK, KG-6",900 Clems Run,Glassboro,08028,Gloucester County,Elk Township School District,2017
804,Lincoln Elementary School,Public,"PK, KG-6",712 Lincoln Avenue,Ridgefield Park,07660,Bergen County,Ridgefield Park Public School District,2017
805,Weston Elementary School,Public,"PK, KG-2",600 Newark Avenue,Manville,08835,Somerset County,Manville School District,2017
806,Fairview Elementary School,Public,"PK, KG-6",376 Berkeley Avenue,Bloomfield,07003,Essex County,Bloomfield Township School District,2017
807,Lindbergh Elementary School,Public,1-6,401 Glen Ave,Palisades Park,07650,Bergen County,Palisades Park School District,2017
808,Robert Morris School,Public,"PK, KG-8",122 Elizabeth Street,South Bound Brook,08880,Somerset County,South Bound Brook Public School District,2017
809,Grade Downing Elementary School,Public,K-3,3rd & Central Aves,Runnemede,08078,Camden County,Runnemede Public School District,2017
810,H Ashton Marsh,Public,"PK, KG-4",800 Irelan Ave,Absecon,08201,Atlantic County,Absecon Public Schools District,2017
811,Southampton Township School #2,Public,3-5,100 Miss Mabel Drive,Southampton,08088,Burlington County,Southampton Township School District,2017
812,Merriam Avenue School,Public,"PK, KG-4",81 Merriam Avenue,Newton,07860,Sussex County,Newton Public School District,2017
813,Middle Township Elementary #2,Public,3-5,101 West Pacific Ave,Cape May Court House,08210,Cape May County,Middle Township Public School District,2017
814,Broad Street Elementary School,Public,"PK, KG-5",255 West Broad St,Gibbstown,08027,Gloucester County,Greenwich Township School District,2017
815,Apshawa Elementary School,Public,K-5,140 High Crest Drive,West Milford,07480,Passaic County,West Milford Township Public School District,2017
816,Gilbert Avenue School,Public,"PK, KG-5",151 Gilbert Avenue,Elmwood Park,07407,Bergen County,Elmwood Park School District,2017
817,Washington Irving School #4,Public,"PK, KG-5",12 Madonna Place,Garfield,07026,Bergen County,Garfield Public School District,2017
818,Pennsylvania Avenue Elementary School,Public,"PK, KG-5",Pennsylvania Avenue,Colonia,07067,Middlesex County,Woodbridge Township School District,2017
819,Ford Avenue Elementary School,Public,K-5,186 Ford Avenue,Fords,08863,Middlesex County,Woodbridge Township School District,2017
820,Norman S. Weir,Public,K-8,152 College Boulevard,Paterson,07505,Passaic County,Paterson Public School District,2017
821,Shelia Y. Oliver Academy,Public,"PK, KG-7",404 North Grove Street,East Orange,07017,Essex County,East Orange School District,2017
822,Richmond Avenue School,Public,"PK, KG-8",4115 Ventnor Avenue,Atlantic City,08401,Atlantic County,Atlantic City School District,2017
823,Helen L Beeler,Public,K-5,60 Caldwell Ave,Marlton,08053,Burlington County,Evesham Township School District,2017
824,Jefferson Elementary School,Public,"PK, KG-4",3400 Palisade Avenue,Union City,07087,Hudson County,Union City School District,2017
825,Franklin Borough School,Public,"PK, KG-8",50 Washington Avenue,Franklin,07416,Sussex County,Franklin Borough School District,2017
826,Schuyler Elementary School,Public,"PK, KG-6",644 Forest St,Kearny,07032,Hudson County,Kearny,2017
827,Vineland Public Charter School,"Public, Charter","PK, KG-8",1480 Pennsylvania Ave.,Vineland,08332,Cumberland County,Vineland Public Charter School,2017
828,Fountain Woods Elementary School,Public,2-5,601 Fountain Avenue,Burlington,08016,Burlington County,Burlington Township School District,2017
829,Private Nicholas Minue Elementary School,Public,"PK, KG-5",83 Post Blvd,Carteret,07008,Middlesex County,Carteret Public School District,2017
830,School #5,Public,K-5,136 Valley Road,Clifton,07013,Passaic County,Clifton Public School District,2017
831,Slackwood Elementary School,Public,K-3,2060 Princeton Pike,Lawrenceville,08648,Mercer County,Lawrence Township Public School District,2017
832,Nellie K. Parker,Public,"PK, KG-4",261 Maple Hill Dr,Hackensack,07601,Bergen County,Hackensack School District,2017
833,Olivet Elementary School,Public,2-4,235 Sheep Pen Road,Pittsgrove,08318,Salem County,Pittsgrove Township School District,2017
834,Bayville Elementary School,Public,"PK, KG-4",356 Atlantic City Blvd,Bayville,08721,Ocean County,Berkeley Township School District,2017
835,Good Intent Elementary School,Public,2-6,1555 Good Intent Rd,Deptford,08096,Gloucester County,Deptford Township Public School District,2017
836,Chessie Dentley Roberts Academy School No. 30,Public,"PK, KG-8",730 Pennsylvania Ave,Elizabeth,07208,Union County,Elizabeth Public Schools,2017
837,Memorial School,Public,"PK, KG-2",319 New York Avenue,Lyndhurst,07071,Bergen County,Lyndhurst Public School District,2017
838,Wilson School,Public,"PK, KG-5",80 Union Street,Lodi,07644,Bergen County,Lodi School District,2017
839,Belleville PS4,Public,"PK, KG-6",30 Magnolia Street,Belleville,07109,Essex County,Belleville Public School District,2017
840,Clara B. Worth Elementary School,Public,"PK, KG-4",57 Central Parkway,Bayville,08721,Ocean County,Berkeley Township School District,2017
841,Roosevelt Elementary School,Public,"PK, KG-6",733 Kearny Ave,Kearny,07032,Hudson County,Kearny,2017
842,Holly Hills Elementary School,Public,"PK, KG-3",500 Ogden Drive,Westampton,08060,Burlington County,Westampton Township Public School District,2017
843,Loring Flemming Elementary School,Public,K-5,135 Little Gloucester Rd,Blackwood,08012,Camden County,Gloucester Township Public Schools,2017
844,Dr. Albert Einstein Academy School No. 29,Public,"PK, KG-8",919 North Broad Street,Elizabeth,07208,Union County,Elizabeth Public Schools,2017
845,Oak Knoll Elementary School,Public,"PK, KG-4",23 Bodine Avenue,Williamstown,08094,Gloucester County,Monroe Township Public School District,2017
846,James W. Lilley Elementary School,Public,K-5,1275 Williamstown Road,Erial,08081,Camden County,Gloucester Township Public Schools,2017
847,Sixteenth Avenue School,Public,"PK, KG-5",73 Sixteenth Avenue,Elmwood Park,07407,Bergen County,Elmwood Park School District,2017
848,Red Bank Charter School,"Public, Charter","PK, KG-8",58 Oakland Street,Red Bank,07701,Monmouth County,Red Bank Charter School,2017
849,East Dover Elementary School,Public,K-5,725 Vaughn Avenue,Toms River,08753,Ocean County,Toms River Regional School District,2017
850,William L Antheil Elementary School,Public,"PK, KG-5",339 Ewingville Road,Ewing,08638,Mercer County,Ewing Township School District,2017
851,'Franklin Elementary School,Public,"PK, KG-6",100 Davis Ave,Kearny,07032,Hudson County,Kearny,2017
852,Estell Manor Elementary School,Public,K-8,128 Cape May Avenue,Estell Manor,08319,Atlantic County,Estell Manor School District,2017
853,Harry L Bain,Public,K-6,6200 Broadway,West New York,07093,Hudson County,West New York School District,2017
854,Roosevelt Elementary School,Public,"PK, KG-6",508 Teaneck Road,Ridgefield Park,07660,Bergen County,Ridgefield Park Public School District,2017
855,John Adams,Public,"PK, KG-4",1420 Redmond Street,North Brunswick,08902,Middlesex County,North Brunswick Township School District,2017
856,Lucy N. Holman Elementary School,Public,"PK, KG-5",125 Manhattan Street,Jackson,08527,Ocean County,Jackson Township School District,2017
857,Grant Elementary School,Public,K-6,104 Henry St,Ridgefield Park,07660,Bergen County,Ridgefield Park Public School District,2017
858,Ernest J. Finizio Junior - Aldene School,Public,"PK, KG-5",339 West Webster Avenue,Roselle Park,07204,Union County,Roselle Park Public School District,2017
859,School #12,Public,"PK, KG-5",165 Clifton Avenue,Clifton,07011,Passaic County,Clifton Public School District,2017
860,Frog Pond Elementary School,Public,3-6,305 Frog Pond Road,Little Egg Harbor,08087,Ocean County,Little Egg Harbor Township School District,2017
861,Twin Hills Elementary School,Public,K-4,110 Twin Hill Drive,Willingboro,08046,Burlington County,Willingboro Public School District,2017
862,Chews Elementary School,Public,"PK, KG-5",600 Chewslanding Somerdale Rd,Blackwood,08012,Camden County,Gloucester Township Public Schools,2017
863,TEAM Academy Charter School,"Public, Charter, Alternative",K-12,60 Park Place,Newark,07102,Essex County,TEAM Academy Charter School,2017
864,Cold Springs School,Public,"PK, KG-3",1194 Market Street,Gloucester City,08030,Camden County,Gloucester City Public School District,2017
865,Mt Vernon Place School,Public,"PK, KG-8",142 Mount Vernon Pl,Newark,07106,Essex County,Newark Public School District,2017
866,Number 8,Public,"PK, KG-5",500 West Blancke St.,Linden,07036,Union County,Linden Public School District,2017
867,Beachwood Elementary School,Public,K-5,901 Berkeley Avenue,Beachwood,08722,Ocean County,Toms River Regional School District,2017
868,Smithville Elementary School,Public,"PK, KG-6",37 S  Old Port Republic Road,Galloway,08205,Atlantic County,Galloway Township Public School District,2017
869,Green-Fields Elementary School,Public,3-4,15 Hill Lane,Woodbury,08096,Gloucester County,West Deptford Township School District,2017
870,Avenel Street Elementary School,Public,K-5,Avenel Street,Avenel,07001,Middlesex County,Woodbridge Township School District,2017
871,Oaklyn Public School,Public,"PK, KG-5",136 Kendall Blvd,Oaklyn,08107,Camden County,Oaklyn Public School District,2017
872,Christopher Columbus School #8,Public,"PK, KG-5",147 Cedar Street,Garfield,07026,Bergen County,Garfield Public School District,2017
873,Anna L. Klein,Public,"PK, KG-8",301  69th St,Guttenberg,07093,Hudson County,Guttenberg School District,2017
874,Gibbsboro Elementary School,Public,"PK, KG-8",37 Kirkwood Rd,Gibbsboro,08026,Camden County,Gibbsboro Elementary School District,2017
875,Pohatcong Township School,Public,"PK, KG-8",240 Rte  519,Phillipsburg,08865,Warren County,Pohatcong Township School District,2017
876,Main Road School,Public,3-4,1452 Main Rd,Newfield,08344,Gloucester County,Township of Franklin School District,2017
877,Bells Elementary School,Public,K-5,227 Greentree Rd,Turnersville,08012,Gloucester County,Washington Township School District,2017
878,John Greenleaf Whittier Elementary School,Public,K-4,491 W Englewood Avenue,Teaneck,07666,Bergen County,Teaneck School District,2017
879,Thomas Jefferson Elementary School,Public,K-5,95 Altair Dr,Turnersville,08012,Gloucester County,Washington Township School District,2017
880,Shark River Hills Elementary School,Public,"PK, KG-5",312 Brighton Avenue,Neptune,07753,Monmouth County,Neptune Township School District,2017
881,Lower Alloways Creek Elementary School,Public,"PK, KG-8",967 Main St Canton,Salem,08079,Salem County,The Lower Alloways Creek School District,2017
882,Fort Dix Elementary School,Public,"PK, KG-5",1199 Fort Dix  Juliustown Road,Fort Dix,08640,Burlington County,Pemberton Township School District,2017
883,Philip G. Vroom Community School,Public,"PK, KG-8",18 West 26th St,Bayonne,07002,Hudson County,Bayonne School District,2017
884,Thomas Sharp Elementary School,Public,"PK, KG-5",400 Comly Ave,West Collingswood,08107,Camden County,Collingswood Public School District,2017
885,Roosevelt Elementary School,Public,"PK, KG-6",811 St George Ave,Rahway,07065,Union County,Rahway Public School District,2017
886,Weymouth Township Elementary School,Public,"PK, KG-8",1202 Eleventh Avenue,Dorothy,08317,Atlantic County,Weymouth Township School District,2017
887,Charles E. Trefurt School,Public,"PK, KG-5",96 Franklin St,Jersey City,07307,Hudson County,Jersey City Public Schools,2017
888,Tulsa Trail Elementary School,Public,2-3,2 Tulsa Trail,Hopatcong,07843,Sussex County,Hopatcong Borough School District,2017
889,Marie V. Duffy Elementary School,Public,"PK, KG-5",137 East Central Avenue,Wharton,07885,Morris County,Wharton Borough School District,2017
890,Claremont Avenue Elementary School,Public,K-5,Claremont Avenue,Colonia,07067,Middlesex County,Woodbridge Township School District,2017
891,Nathan Hale Elementary School,Public,"PK, KG-5",678 Roosevelt Avenue,Carteret,07008,Middlesex County,Carteret Public School District,2017
892,MacAfee Road School,Public,"PK, KG-5",53 Macafee Road,Somerset,08873,Somerset County,Franklin Township Public School District,2017
893,Lanes Mill Elementary School,Public,K-5,1891 Lanes Mill Rd,Brick,08724,Ocean County,Brick Township Public School District,2017
894,Central Park Elementary School,Public,2-3,43 Oliver Ave,Pennsville,08070,Salem County,Pennsville School District,2017
895,Kisthardt Elementary School,Public,"PK, KG-5",215 Harcourt Drive,Hamilton,08610,Mercer County,Hamilton Township Public School District,2017
896,Folsom Elementary School,Public,"PK, KG-8",1357 Mays Landing Road,Hammonton,08037,Atlantic County,Folsom Borough School District,2017
897,Watsessing Elementary School,Public,K-6,71 Prospect Street,Bloomfield,07003,Essex County,Bloomfield Township School District,2017
898,Perry L. Drew Elementary School,Public,3-5,70 Twin Rivers Drive North,East Windsor,08520,Mercer County,East Windsor Regional School District,2017
899,John F. Kennedy Primary School,Public,K-4,255 Woodmere Street,Raritan,08869,Somerset County,Bridgewater-Raritan Regional School District,2017
900,Haledon Public School,Public,"PK, KG-8",91 Henry Street,Haledon,07508,Passaic County,Haledon Public School District,2017
901,Wedgwood Elementary School,Public,K-5,236 Hurffville Rd,Sewell,08080,Gloucester County,Washington Township School District,2017
902,Emma Havens Young Elementary School,Public,K-5,43 Drum Point Rd,Brick,08723,Ocean County,Brick Township Public School District,2017
903,John C. Milanesi Elementary School,Public,"PK, KG-2",880 Harding Highway,Buena,08310,Atlantic County,Buena Regional School District,2017
904,Camden Prep Inc.,"Public, Alternative",K-10,1575 Mt. Ephraim Ave,Camden,08104,Camden County,Camden Prep Inc.,2017
905,Robert Gordon Elementary School,Public,"PK, KG-5",59 West Grant Avenue,Roselle Park,07204,Union County,Roselle Park Public School District,2017
906,Keyport Central School,Public,"PK, KG-8",335 Broad Street,Keyport,07735,Monmouth County,Keyport School District,2017
907,Grandview Elementary School,Public,K-3,130 North Randolphville Rd,Piscataway,08854,Middlesex County,Piscataway Township School District,2017
908,East End School,Public,"PK, KG-4",170 Oneida Avenue,North Plainfield,07060,Somerset County,North Plainfield School District,2017
909,H & M Potter School,Public,"PK, KG-4",60 Veeder Lane,Bayville,08721,Ocean County,Berkeley Township School District,2017
910,George L. Hess Educational Complex,Public,2-5,700 Babcock Road,Mays Landing,08330,Atlantic County,Hamilton Township School District,2017
911,Mount Pleasant Elementary School,Public,K-5,100 Carmel Rd,Millville,08332,Cumberland County,Millville School District,2017
912,Crest Memorial School,Public,"PK, KG-8",9100 Pacific Ave,Wildwood Crest,08260,Cape May County,Wildwood Crest Borough School District,2017
913,Magnolia,Public,"PK, KG-8",420 North Warwick Rd,Magnolia,08049,Camden County,Magnolia School District,2017
914,Ocean Township Elementary School,Public,"PK, KG-4",555 Dow Avenue,Oakhurst,07755,Monmouth County,Township of Ocean School District,2017
915,Washington Community School #9,Public,"PK, KG-8",191 Avenue B,Bayonne,07002,Hudson County,Bayonne School District,2017
916,Grace N. Rogers Elementary School,Public,3-5,380 Stockton St,Hightstown,08520,Mercer County,East Windsor Regional School District,2017
917,Matthew Jago Elementary School,Public,"PK, KG-5",99 Central Avenue,Sewaren,07077,Middlesex County,Woodbridge Township School District,2017
918,Beverly City School District,Public,"PK, KG-8",601 Bentley Ave,Beverly,08010,Burlington County,Beverly City School District,2017
919,Jersey City Golden Door Charter School,"Public, Charter","PK, KG-8",3044 Kennedy Blvd,Jersey City,07306,Hudson County,Jersey City Golden Door Charter School,2017
920,Lincoln Community School #5,Public,"PK, KG-8",208 Prospect Avenue,Bayonne,07002,Hudson County,Bayonne School District,2017
921,South River Elementary School,Public,2-5,81 Johnson Place,South River,08882,Middlesex County,South River Public School District,2017
922,Joseph T. Donahue Elementary School,Public,3-4,200 Bengal Blvd,Barnegat,08005,Ocean County,Barnegat Township School District,2017
923,Veterans' Memorial Elementary School,Public,"PK, KG-5",1401 Central Avenue,Union City,07087,Hudson County,Union City School District,2017
924,Tuckerton Elementary School,Public,"PK, KG-6",Marine Street,Tuckerton,08087,Ocean County,Tuckerton Borough School District,2017
925,Ocean Gate Elementary School,Public,"PK, KG-6",126 West Arverne Avenue,Ocean Gate,08740,Ocean County,Ocean Gate School District,2017
926,Van Derveer Elementary School,Public,"PK, KG-5",51 Union Ave.,Somerville,08876,Somerset County,Somerville Public School District,2017
927,James F. Murray School,Public,"PK, KG-8",339 Stegman Parkway,Jersey City,07305,Hudson County,Jersey City Public Schools,2017
928,Abraham Lincoln School No. 14,Public,K-8,50 Grove Street,Elizabeth,07202,Union County,Elizabeth Public Schools,2017
929,Drum Point Road Elementary School,Public,K-5,41 Drum Point Rd,Brick,08723,Ocean County,Brick Township Public School District,2017
930,The Village Charter School,"Public, Charter",K-8,101 Sullivan Way,Trenton,08638,Mercer County,The Village Charter School,2017
931,Warren G. Harding Elementary School,Public,"PK, KG-6",426 Boulevard,Kenilworth,07033,Union County,Kenilworth School District,2017
932,School #14,Public,"PK, KG-5",99 St  Andrews Boulevard,Clifton,07012,Passaic County,Clifton Public School District,2017
933,Woodrow Wilson Elementary School,Public,"PK, KG-8",133 Tunison Rd,New Brunswick,08901,Middlesex County,New Brunswick School District,2017
934,Garfield Elementary School,Public,"PK, KG-6",360 Belgrove Dr,Kearny,07032,Hudson County,Kearny,2017
935,Cliffwood Elementary School,Public,"PK, KG-3",422 Cliffwood Avenue,Cliffwood,07721,Monmouth County,Matawan-Aberdeen Regional School District,2017
936,Myron L. Powell Elementary School,Public,"PK, KG-8",225 Main Street,Cedarville,08311,Cumberland County,Lawrence Township School District,2017
937,Beatrice Gilmore School,Public,3-5,1075 McBride Avenue,Woodland Park,07424,Passaic County,Woodland Park School District,2017
938,School #16,Public,K-5,755 Grove Street,Clifton,07013,Passaic County,Clifton Public School District,2017
939,Fairmount,Public,"PK, KG-4",105 Grand Avenue,Hackensack,07601,Bergen County,Hackensack School District,2017
940,Lincoln Elementary School,Public,"PK, KG-3",37 Keller Avenue,Rockaway,07866,Morris County,Rockaway Borough School District,2017
941,Eastampton Township Community School,Public,"PK, KG-8",1 Student Drive,Eastampton,08060,Burlington County,Eastampton Township School District,2017
942,Parkview Elementary School,Public,"PK, KG-6",101 Birch St,Westville,08093,Gloucester County,Westville Boro Public School District,2017
943,Theodore Roosevelt Elementary School,Public,"PK, KG-6",4507 Hudson Ave,Union City,07087,Hudson County,Union City School District,2017
944,McKinley Elementary School,Public,K-8,3110 Liberty Ave,North Bergen,07047,Hudson County,North Bergen School District,2017
945,Ridgeway Elementary School,Public,"PK, KG-5",2861 Ridgeway Rd,Manchester,08759,Ocean County,Manchester Township School District,2017
946,Woodrow Wilson Elementary School,Public,K-3,65 Dane Street,Sayreville,08872,Middlesex County,Sayreville School District,2017
947,Sunnybrae Elementary School,Public,K-5,166 Elton Avenue,Hamilton,08620,Mercer County,Hamilton Township Public School District,2017
948,School #15,Public,"PK, KG-5",700 Gregory Avenue,Clifton,07011,Passaic County,Clifton Public School District,2017
949,Belmar Elementary,Public,"PK, KG-8",1101 Main Street,Belmar,07719,Monmouth County,Belmar Elementary School District,2017
950,Washington Elementary School,Public,"PK, KG-5",289 Main St,West Orange,07052,Essex County,West Orange Public Schools,2017
951,Number 1,Public,"PK, KG-5",728 North Wood Ave.,Linden,07036,Union County,Linden Public School District,2017
952,Charles Street School,Public,"PK, KG-5",100 W  Charles Street,Palmyra,08065,Burlington County,Palmyra Public School District,2017
953,Colin Powell Elementary School,Public,K-5,1500 New York Avenue,Union City,07087,Hudson County,Union City School District,2017
954,Ethel M Burke Elementary School,Public,K-4,112 South Black Horse Pike,Bellmawr,08031,Camden County,Bellmawr Public School District,2017
955,Dionne Warwick Institute,Public,"PK, KG-5",120 Central Ave,East Orange,07018,Essex County,East Orange School District,2017
956,Franklin Elementary School,Public,K-4,8 Meeker Street,Succasunna,07876,Morris County,Roxbury Township School District,2017
957,M. Joan Pearson Elementary School,Public,K-5,1301 Burlington Ave,Delanco,08075,Burlington County,Delanco Township School District,2017
958,Winslow Township Elementary School Two,Public,"PK, KG-3",125 First Avenue,Sicklerville,08081,Camden County,Winslow Township School District,2017
959,New Hanover Township School,Public,"PK, KG-8",122 Fort Dix Street,Wrightstown,08562,Burlington County,New Hanover Township,2017
960,G.H. Carson Elementary School,Public,"PK, KG-3",4150 Garfield Avenue,Pennsauken,08109,Camden County,Pennsauken Township Board of Education School District,2017
961,Berkeley Elementary School,Public,K-6,351 Bloomfield Ave,Bloomfield,07003,Essex County,Bloomfield Township School District,2017
962,Paul Robeson Community School for the Arts,Public,"PK, KG-8",199 Commercial Ave,New Brunswick,08901,Middlesex County,New Brunswick School District,2017
963,Blackwood Elementary School,Public,"PK, KG-5",260 Blenheim  Erial Rd,Blackwood,08012,Camden County,Gloucester Township Public Schools,2017
964,Jackson Avenue,Public,"PK, KG-4",421 Jackson Ave,Hackensack,07601,Bergen County,Hackensack School District,2017
