rank,school,type,grades,address,city,zip,county,district,year
1,Dr Ronald McNair High School,Public,9-12,123 Coles  Street,Jersey City,07302,Hudson County,Jersey City Public Schools,2020
2,Academy For Information Technology,Public,9-12,1776 Raritan Road,Scotch Plains,07076,Union County,Union County Vocational-Technical School District,2020
3,Academy for Mathematics Science and Engineering,Public,9-12,520 West Main Street,Rockaway,07866,Morris County,Morris County Vocational School District,2020
4,Bergen County Technical High School - Teterboro,Public,9-12,504 Route 46 West,Teterboro,07608,Bergen County,Bergen County Vocational Technical School District,2020
5,West Windsor-Plainsboro High School North,Public,9-12,90 Grovers Mill Road,Plainsboro,08536,Middlesex County,West Windsor-Plainsboro Regional School District,2020
6,Infinity Institute,Public,6-12,193 Old Bergen Road,Jersey City,07305,Hudson County,Jersey City Public Schools,2020
7,West Windsor-Plainsboro High School South,Public,9-12,346 Clarksville Road,West Windsor,08550,Mercer County,West Windsor-Plainsboro Regional School District,2020
8,Morris County School of Technology,Public,9-12,400 East Main Street,Denville,07834,Morris County,Morris County Vocational School District,2020
9,Glen Ridge High School,Public,7-12,200 Ridgewood Ave,Glen Ridge,07028,Essex County,Glen Ridge Public School District,2020
10,Diana C. Lobosco STEM Academy,Public,9-12,45 Reinhardt Road,Wayne,07470,Passaic County,Passaic County Technical-Vocational School District,2020
11,Ridge High School,Public,9-12,268 South Finley Avenue,Basking Ridge,07920,Somerset County,Bernards Township School District,2020
12,Millburn High School,Public,9-12,462 Millburn Ave,Millburn,07041,Essex County,Millburn Township School District,2020
13,Union County Technical,Public,9-12,1776 Raritan Rd,Scotch Plains,07076,Union County,Union County Vocational-Technical School District,2020
14,New Providence High School,Public,9-12,35 Pioneer Dr,New Providence,07974,Union County,New Providence School District,2020
15,Chatham High School,Public,9-12,255 Lafayette Avenue,Chatham,07928,Morris County,School District of the Chathams,2020
16,Ridgewood High School,Public,9-12,627 East Ridgewood Ave,Ridgewood,07451,Bergen County,Ridgewood Public School District,2020
17,Academy For Performing Arts,Public,9-12,1776 Raritan Road,Scotch Plains,07076,Union County,Union County Vocational-Technical School District,2020
18,Central Jersey College Prep Charter School,"Public, Charter, Alternative",K-12,101 Mettlers Road,Somerset,08873,Somerset County,Central Jersey College Prep Charter School,2020
19,Applied Technology High School,Public,9-12,400 Paramus Road,Paramus,07652,Bergen County,Bergen County Vocational Technical School District,2020
20,Summit High School,Public,9-12,125 Kent Place Blvd,Summit,07901,Union County,Summit Public School District,2020
21,Moorestown High School,Public,9-12,350 Bridgeboro Road,Moorestown,08057,Burlington County,Moorestown Township Public School District,2020
22,West Morris Mendham High School,Public,9-12,65 East Main Street,Mendham,07945,Morris County,West Morris Regional High School District,2020
23,Northern Valley Regional High School at Demarest,Public,9-12,150 Knickerbocker Road,Demarest,07627,Bergen County,Northern Valley Regional High School District,2020
24,Tenafly High School,Public,9-12,19 Columbus Drive,Tenafly,07670,Bergen County,Tenafly Public School District,2020
25,East Brunswick High School,Public,10-12,380 Cranbury Road,E Brunswick,08816,Middlesex County,East Brunswick Township School District,2020
26,Thomas Edison EnergySmart Charter School,"Public, Charter, Alternative",K-12,150 Pierce Street,Somerset,08873,Somerset County,Thomas Edison EnergySmart Charter School,2020
27,John P. Stevens High School,Public,9-12,855 Grove Avenue,Edison,08820,Middlesex County,Edison Township School District,2020
28,Montgomery High School,Public,9-12,1016 Route 601,Skillman,08558,Somerset County,Montgomery Township School District,2020
29,Westfield Senior High School,Public,9-12,550 Dorian Road,Westfield,07090,Union County,Westfield Public School District,2020
30,Glen Rock High School,Public,9-12,400 Hamilton Avenue,Glen Rock,07452,Bergen County,Glen Rock Public School District,2020
31,Rumson-Fair Haven Regional High School,Public,9-12,74 Ridge Road,Rumson,07760,Monmouth County,Rumson-Fair Haven Regional High School District,2020
32,Livingston High School,Public,9-12,30 Robert Harp Drive,Livingston,07039,Essex County,Livingston Board of Education School District,2020
33,Cresskill High School,Public,9-12,220 Jefferson Ave,Cresskill,07626,Bergen County,Cresskill Public School District,2020
34,Princeton High School,Public,9-12,151 Moore Street,Princeton,08540,Mercer County,Princeton Public School District,2020
35,Park Ridge High School,Public,7-12,2 Park Ave,Park Ridge,07656,Bergen County,Park Ridge School District,2020
36,Mercer County Technical School STEM Academy,Public,9-12,129 Bull Run Road,Pennington,08534,Mercer County,Area Vocational Technical School District of Mercer County,2020
37,Haddonfield Memorial High School,Public,9-12,401 Kings Highway East,Haddonfield,08033,Camden County,Haddonfield School District,2020
38,Holmdel High School,Public,9-12,36 Crawfords Corner Road,Holmdel,07733,Monmouth County,Holmdel Township School District,2020
39,Pascack Hills High School,Public,9-12,225 West Grand Avenue,Montvale,07645,Bergen County,Pascack Valley Regional High School District,2020
40,West Morris Central High School,Public,9-12,259 Bartley Road,Chester,07930,Morris County,West Morris Regional High School District,2020
41,Cumberland County Technical Education Center,Public,9-12,3400 College Drive,Millville,08332,Cumberland County,Cumberland County Board of Vocational Education,2020
42,Northern Valley Regional High School at Old Tappan,Public,9-12,140 Central Avenue,Old Tappan,07675,Bergen County,Northern Valley Regional High School District,2020
43,Madison High School,Public,9-12,170 Ridgedale Avenue,Madison,07940,Morris County,Madison Public School District,2020
44,High Technical High School,Public,9-12,One High Tech Way,Secaucus,07094,Hudson County,Hudson County Schools of Technology School District,2020
45,Metuchen High School,Public,9-12,400 Grove Ave,Metuchen,08840,Middlesex County,Metuchen Public School District,2020
46,Northern Highlands Regional High School,Public,9-12,298 Hillside Ave,Allendale,07401,Bergen County,Northern Highlands Regional High School District,2020
47,Marlboro High School,Public,9-12,95 North Main Street,Marlboro,07746,Monmouth County,Freehold Regional High School District,2020
48,Ocean County Vocational Technical School Waretown Center,Public,9-12,423 Wells Mills Road,Waretown,08758,Ocean County,Ocean County Vocational Technical School District,2020
49,Hillsborough High School,Public,9-12,466 Raider Boulevard,Hillsborough,08844,Somerset County,Hillsborough Township Public School District,2020
50,Gloucester County Institute of Technology,Public,9-12,1360 Tanyard Road,Sewell,08080,Gloucester County,Gloucester County Vocational-Technical School District,2020
51,Hopewell Valley Central High School,Public,9-12,259 Pennington Titusville Rd,Pennington,08534,Mercer County,Hopewell Valley Regional School District,2020
52,County Prep High School,Public,9-12,525 Montgomery Street,Jersey City,07306,Hudson County,Hudson County Schools of Technology School District,2020
53,Science Park High School,Public,7-12,260 Norfolk Street,Newark,07102,Essex County,Newark Public School District,2020
54,STEM Innovation Academy of the Oranges,Public,9-12,445 Scotland Road,South Orange,07079,Essex County,ORANGE BOARD OF EDUCATION School District,2020
55,Fair Lawn High School,Public,9-12,14  00 Berdan Avenue,Fair Lawn,07410,Bergen County,Fair Lawn Public School District,2020
56,River Dell Regional High School,Public,9-12,55 Pyle Street,Oradell,07649,Bergen County,River Dell Regional School District,2020
57,Elizabeth High School - Frank J Cicarell Academy,Public,9-12,40 Morrell Street,Elizabeth,07202,Union County,Elizabeth Public Schools,2020
58,Jose Marti STEM Academy,Public,9-12,1800 Summit Ave,Union City,07087,Hudson County,Union City School District,2020
59,Somerset County Vocational Technical High School,Public,9-12,14 Vogt Drive,Bridgewater,08807,Somerset County,Somerset County Vocational and Technical School District,2020
60,Academy for Environmental Science,Public,9-12,1010 Weldon Road,Oak Ridge,07438,Morris County,Morris County Vocational School District,2020
61,Cranford High School,Public,9-12,201 West End Place,Cranford,07016,Union County,Cranford Public School District,2020
62,Montclair High School,Public,9-12,100 Chestnut St,Montclair,07042,Essex County,Montclair Public School District,2020
63,Scotch Plains-Fanwood High School,Public,9-12,667 Westfield Road,Scotch Plains,07076,Union County,Scotch Plains-Fanwood School District,2020
64,West Essex High School,Public,9-12,65 West Greenbrook Rd,North Caldwell,07006,Essex County,West Essex Regional School District,2020
65,Indian Hills High School,Public,9-12,97 Yawpo Ave,Oakland,07436,Bergen County,Ramapo Indian Hills Regional High School District,2020
66,Governor Livingston High School,Public,9-12,175 Watchung Boulevard,Berkeley Heights,07922,Union County,Berkeley Heights School District,2020
67,Midland Park Junior/Senior High School,Public,7-12,250 Prospect St,Midland Park,07432,Bergen County,Midland Park School District,2020
68,Mahwah High School,Public,9-12,50 Ridge Road,Mahwah,07430,Bergen County,Mahwah Township Public School District,2020
69,Kinnelon High School,Public,9-12,121 Kinnelon Road,Kinnelon,07405,Morris County,Kinnelon School District,2020
70,Montville Township High School,Public,9-12,100 Horseneck Road,Montville,07045,Morris County,Montville Township School District,2020
71,Robbinsville High School,Public,9-12,155 Robbinsville Edinburg Rd,Robbinsville,08691,Mercer County,Robbinsville Public Schools,2020
72,Haddon Township High School,Public,9-12,406 Memorial Avenue,Westmont,08108,Camden County,Haddon Township School District,2020
73,Watchung Hills Regional High School,Public,9-12,108 Stirling Rd.,Warren,07059,Somerset County,Watchung Hills Regional High School District,2020
74,South Brunswick High School,Public,9-12,750 Ridge Road,Monmouth Junction,08852,Middlesex County,South Brunswick School District,2020
75,Bernards High School,Public,9-12,25 Olcott Avenue,Bernardsville,07924,Somerset County,Somerset Hills Regional School District,2020
76,Wayne Valley High School,Public,9-12,551 Valley Road,Wayne,07470,Passaic County,Wayne Township Public School District,2020
77,Sparta High School,Public,9-12,70 West Mountain Road,Sparta,07871,Sussex County,Sparta Township Public School District,2020
78,Colts Neck High School,Public,9-12,59 Five Points Road,Colts Neck,07722,Monmouth County,Freehold Regional High School District,2020
79,Shawnee High School,Public,9-12,600 Tabernacle Road,Medford,08055,Burlington County,Lenape Regional High School District,2020
80,Monroe Township High School,Public,9-12,200 Schoolhouse Road,Monroe Township,08831,Middlesex County,Monroe Township School District,2020
81,Westwood Regional High School,Public,9-12,701 Ridgewood Road,Township Of Washington,07676,Bergen County,Westwood Regional School District,2020
82,Parsippany Hills High School,Public,9-12,20 Rita Drive,Morris Plains,07950,Morris County,Parsippany-Troy Hills Township School District,2020
83,North Hunterdon High School,Public,9-12,1445 State Route 31,Annandale,08801,Hunterdon County,North Hunterdon-Voorhees Regional High School District,2020
84,Fort Lee High School,Public,9-12,3000 Lemoine Ave,Fort Lee,07024,Bergen County,Fort Lee School District,2020
85,Cherry Hill High School East,Public,9-12,1750 Kresson Rd.,Cherry Hill,08003,Camden County,Cherry Hill School District,2020
86,Henry Hudson Regional School,Public,7-12,1 Grand Tour,Highlands,07732,Monmouth County,Henry Hudson Regional School District,2020
87,Ramapo High School,Public,9-12,331 George Street,Franklin Lakes,07417,Bergen County,Ramapo Indian Hills Regional High School District,2020
88,Wayne Hills High School,Public,9-12,272 Berdan Avenue,Wayne,07470,Passaic County,Wayne Township Public School District,2020
89,Technology High School,Public,9-12,223 Broadway,Newark,07102,Essex County,Newark Public School District,2020
90,Columbia High School,Public,9-12,17 Parker Ave,Maplewood,07040,Essex County,South Orange-Maplewood School District,2020
91,Emerson Junior Senior High,Public,7-12,131 Main Street,Emerson,07630,Bergen County,Emerson Public School District,2020
92,Whippany Park High School,Public,9-12,165 Whippany Road,Whippany,07981,Morris County,Hanover Park Regional High School District,2020
93,Manalapan High School,Public,9-12,20 Church Lane,Englishtown,07726,Monmouth County,Freehold Regional High School District,2020
94,Eastern Regional High School,Public,9-12,1401 Laurel Oak Road,Voorhees,08043,Camden County,Eastern Camden County Regional School District,2020
95,Mount Olive High School,Public,9-12,18 Corey Road,Flanders,07836,Morris County,Mount Olive Township School District,2020
96,James Caldwell High School,Public,9-12,265 Westville Ave,West Caldwell,07006,Essex County,Caldwell-West School District,2020
97,Voorhees High School,Public,9-12,256 County Route 513,Glen Gardner,08826,Hunterdon County,North Hunterdon-Voorhees Regional High School District,2020
98,Bridgewater-Raritan High School,Public,9-12,600 Garretson Road,Bridgewater,08807,Somerset County,Bridgewater-Raritan Regional School District,2020
99,Hunterdon Central Regional High School District,Public,9-12,84 Route 31,Flemington,08822,Hunterdon County,Hunterdon Central Regional High School District,2020
100,Pascack Valley High School,Public,9-12,200 Piermont Avenue,Hillsdale,07642,Bergen County,Pascack Valley Regional High School District,2020
101,Roxbury High School,Public,9-12,One Bryant Drive,Succasunna,07876,Morris County,Roxbury Township School District,2020
102,Lenape High School,Public,9-12,235 Hartford Road,Medford,08055,Burlington County,Lenape Regional High School District,2020
103,Freehold Township High School,Public,9-12,281 Elton Adelphia Road,Freehold,07728,Monmouth County,Freehold Regional High School District,2020
104,Allentown High School,Public,9-12,27 High Street,Allentown,08501,Monmouth County,Upper Freehold Regional School District,2020
105,Hackettstown High School,Public,9-12,599 Warren Street,Hackettstown,07840,Warren County,Hackettstown Public School District,2020
106,Highland Park High School,Public,9-12,102 North Fifth Avenue,Highland Park,08904,Middlesex County,Highland Park Boro School District,2020
107,Hanover Park High School,Public,9-12,63 Mt  Pleasant Avenue,East Hanover,07936,Morris County,Hanover Park Regional High School District,2020
108,Leonia High School,Public,9-12,100 Christie Heights Street,Leonia,07605,Bergen County,Leonia Public School District,2020
109,Dumont High School,Public,9-12,101 New Milford Ave,Dumont,07628,Bergen County,Dumont Public School District,2020
110,South Plainfield High School,Public,9-12,200 Lake Street,South Plainfield,07080,Middlesex County,South Plainfield School District,2020
111,OCVTS Grunin Performing Arts Academy,Public,9-12,1 College Drive Bldg. #12,Toms River,08754,Ocean County,Ocean County Vocational Technical School District,2020
112,Delaware Valley Regional High School,Public,9-12,19 Senator Stout Rd,Frenchtown,08825,Hunterdon County,Delaware Valley Regional High School District,2020
113,Lenape Valley Regional High School,Public,9-12,28 Sparta Road,Stanhope,07874,Sussex County,Lenape Valley Regional High School District,2020
114,Seneca High School,Public,9-12,110 Carranza Road,Tabernacle,08088,Burlington County,Lenape Regional High School District,2020
115,Cherokee High School,Public,9-12,120 Tomlinson Mill Road,Marlton,08053,Burlington County,Lenape Regional High School District,2020
116,Ocean City High School,Public,9-12,501 Atlantic Avenue,Ocean City,08226,Cape May County,Ocean City School District,2020
117,Middletown High School South,Public,9-12,900 Nut Swamp Road,Middletown,07748,Monmouth County,Middletown Township Public School District,2020
118,Verona High School,Public,9-12,151 Fairview Ave,Verona,07044,Essex County,Verona Public School District,2020
119,Manasquan High School,Public,9-12,167 Broad Street,Manasquan,08736,Monmouth County,Manasquan School District,2020
120,Weehawken High School,Public,7-12,53 Liberty Place,Weehawken,07086,Hudson County,Weehawken Public School District,2020
121,Morris Knolls High School,Public,9-12,50 Knoll Drive,Denville,07834,Morris County,Morris Hills Regional School District,2020
122,Bergen Arts and Sciences Charter School,"Public, Charter, Alternative",K-12,200 MacArthur Avenue,Garfield,07026,Bergen County,Bergen Arts and Science Charter School,2020
123,Mercer County Technical School Health Sciences Academy,Public,9-12,1085 Old Trenton Road,Trenton,08690,Mercer County,Area Vocational Technical School District of Mercer County,2020
124,Academy for Performing Arts,Public,9-12,50 Knoll Drive,Rockaway,07866,Morris County,Morris County Vocational School District,2020
125,Howell High School,Public,9-12,405 Squankum  Yellowbrook Road,Farmingdale,07727,Monmouth County,Freehold Regional High School District,2020
126,Shore Regional High School,Public,9-12,132 Monmouth Park Highway 36,West Long Branch,07764,Monmouth County,Shore Regional High School District,2020
127,Cinnaminson High School,Public,9-12,1197 Riverton Road,Cinnaminson,08077,Burlington County,Cinnaminson Township School District,2020
128,Morris Hills High School,Public,9-12,520 West Main Street,Rockaway,07866,Morris County,Morris Hills Regional School District,2020
129,West Deptford High School,Public,9-12,1600 Old Crown Point Rd,West Deptford,08093,Gloucester County,West Deptford Township School District,2020
130,Point Pleasant Beach High School,Public,9-12,700 Trenton Avenue,Point Pleasant Beach,08742,Ocean County,Point Pleasant Beach School District,2020
131,North Star Academy Charter School,"Public, Charter, Alternative",K-12,10 Washington Place,Newark,07102,Essex County,North Star Academy Charter School,2020
132,Paramus High School,Public,9-12,99 East Century Road,Paramus,07652,Bergen County,Paramus Public School District,2020
133,John F. Kennedy Memorial High School,Public,9-12,200 Washington Avenue,Iselin,08830,Middlesex County,Woodbridge Township School District,2020
134,Matawan Regional High School,Public,9-12,450 Atlantic Avenue,Aberdeen,07747,Monmouth County,Matawan-Aberdeen Regional School District,2020
135,East Orange STEM Academy High School,Public,6-12,129 Renshaw Avenue,East Orange,07017,Essex County,East Orange School District,2020
136,Passaic Academy for Science and Engineering,Public,6-12,291 Lafayette Avenue,Passaic,07055,Passaic County,Passaic City School District,2020
137,Northern Burlington County Regional High School,Public,9-12,160 Mansfield Road East,Columbus,08022,Burlington County,Northern Burlington County Regional School District,2020
138,Ramsey High School,Public,9-12,256 E  Main Street,Ramsey,07446,Bergen County,Ramsey School District,2020
139,Rutherford High School,Public,9-12,56 Elliott Pl,Rutherford,07070,Bergen County,Rutherford School District,2020
140,Somerville High School,Public,9-12,222 Davenport St.,Somerville,08876,Somerset County,Somerville Public School District,2020
141,Burlington Township High School,Public,9-12,610 Fountain Avenue,Burlington,08016,Burlington County,Burlington Township School District,2020
142,Cedar Creek High School,Public,9-12,1701 New York Ave.,Egg Harbor City,08215,Atlantic County,Greater Egg Harbor Regional High School District,2020
143,Freehold Borough High School,Public,9-12,2 Robertsville Road,Freehold,07728,Monmouth County,Freehold Regional High School District,2020
144,Pequannock Township High School,Public,9-12,85 Sunset Road,Pompton Plains,07444,Morris County,Pequannock Township School District,2020
145,Haddon Heights Junior/Senior High School,Public,7-12,301 Second Avenue,Haddon Heights,08035,Camden County,HADDON HEIGHTS School District,2020
146,Washington Township High School,Public,9-12,519 Hurffville  Crosskeys Rd,Sewell,08080,Gloucester County,Washington Township School District,2020
147,Point Pleasant Borough High School,Public,9-12,Laura Herbert Dr,Point Pleasant Beach,08742,Ocean County,Point Pleasant Borough School District,2020
148,Warren County Vocational Technical School,Public,9-12,1500 Route 57,Washington,07882,Warren County,Warren County Vocational Technical School,2020
149,New Egypt High School,Public,9-12,117 Evergreen Road,New Egypt,08533,Ocean County,Plumsted Township School District,2020
150,Old Bridge High School,Public,9-12,4209 Route 516,Matawan,07747,Middlesex County,Old Bridge Township School District,2020
151,Egg Harbor Township High School,Public,9-12,24 High School Drive,Egg Harbor Township,08234,Atlantic County,Egg Harbor Township School District,2020
152,Mainland Regional High School,Public,9-12,1301 Oak Avenue,Linwood,08221,Atlantic County,Mainland Regional High School,2020
153,Cape May County Technical High School,Public,9-12,188 Crest Haven Rd,Cape May Court House,08210,Cape May County,Cape May County Technical High School District,2020
154,Hightstown High School,Public,9-12,25 Leshin Lane,Hightstown,08520,Mercer County,East Windsor Regional School District,2020
155,Kittatinny Regional High School,Public,7-12,77 Halsey Road,Newton,07860,Sussex County,Kittatinny Regional School District,2020
156,North Warren Regional School,Public,7-12,10 Noe Rd,Blairstown,07825,Warren County,North Warren Regional School District,2020
157,Parsippany High School,Public,9-12,309 Baldwin Rd,Parsippany,07054,Morris County,Parsippany-Troy Hills Township School District,2020
158,Lawrence High School,Public,9-12,2525 Princeton Pike,Lawrenceville,08648,Mercer County,Lawrence Township Public School District,2020
159,Passaic County Technical Institute,Public,9-12,45 Reinhardt Road,Wayne,07470,Passaic County,Passaic County Technical-Vocational School District,2020
160,Kingsway Regional High School,Public,9-12,201 Kings Highway,Woolwich Twp,08085,Gloucester County,Kingsway Regional School District,2020
161,Delsea Regional High School,Public,9-12,242 Fries Mill Rd,Franklinville,08322,Gloucester County,Delsea Regional High School District,2020
162,Randolph High School,Public,9-12,511 Millbrook Avenue,Randolph,07869,Morris County,Randolph Township School District,2020
163,Middlesex County Vocational School East Brunswick,Public,9-12,112 Rues Lane,East Brunswick,08816,Middlesex County,Middlesex County Vocational and Technical School District,2020
164,Florence Township Memorial High School,Public,9-12,1050 Cedar Lane,Burlington,08016,Burlington County,Florence Township School District,2020
165,Jackson Memorial High School,Public,9-12,101 Don Connor Boulevard,Jackson,08527,Ocean County,Jackson Township School District,2020
166,Cedar Grove High School,Public,9-12,90 Rugby Road,Cedar Grove,07009,Essex County,Cedar Grove Township School District,2020
167,Piscataway Township High School,Public,9-12,100 Behmer Road,Piscataway,08854,Middlesex County,Piscataway Township School District,2020
168,Arthur P. Schalick High School,Public,9-12,718 Centerton Road,Pittsgrove,08318,Salem County,Pittsgrove Township School District,2020
169,Ridgefield Memorial High School,Public,9-12,555 Walnut St,Ridgefield,07657,Bergen County,Ridgefield School District,2020
170,Liberty High School,Public,9-12,299 Sip Avenue,Jersey City,07306,Hudson County,Jersey City Public Schools,2020
171,Clearview Regional High School,Public,9-12,625 Breakneck Rd,Mullica Hill,08062,Gloucester County,Clearview Regional High School District,2020
172,Wallkill Valley Regional High School,Public,9-12,10 Grumm Road,Hamburg,07419,Sussex County,Wallkill Valley Regional High School,2020
173,Lodi High School,Public,9-12,99 Putnam Street,Lodi,07644,Bergen County,Lodi School District,2020
174,Southern Regional High School,Public,9-12,90 Cedar Bridge Road,Manahawkin,08050,Ocean County,Southern Regional School District,2020
175,Rancocas Valley Regional High School,Public,9-12,520 Jacksonville Road,Mount Holly,08060,Burlington County,Rancocas Valley Regional High School District,2020
176,Edison High School,Public,9-12,50 Boulevard Of The Eagles,Edison,08817,Middlesex County,Edison Township School District,2020
177,Saddle Brook Middle/High School,Public,7-12,355 Mayhill Street,Saddle Brook,07663,Bergen County,Saddle Brook School District,2020
178,Dwight Morrow High School/Academies@Englewood,Public,9-12,274 Knickerbocker Rd,Englewood,07631,Bergen County,Englewood Public School District,2020
179,Phillipsburg High School,Public,9-12,1 Stateliner Blvd.,Phillipsburg,08865,Warren County,Phillipsburg School District,2020
180,Warren Hills Regional High School,Public,9-12,41 Jackson Valley Road,Washington,07882,Warren County,Warren Hills Regional School District,2020
181,Pompton Lakes High School,Public,9-12,44 Lakeside Avenue,Pompton Lakes,07442,Passaic County,Pompton Lakes School District,2020
182,Delran High School,Public,9-12,50 Hartford Road,Delran,08075,Burlington County,Delran Township School District,2020
183,Sayreville War Memorial High School,Public,9-12,820 Washington Road,Parlin,08859,Middlesex County,Sayreville School District,2020
184,Wall High School,Public,9-12,1630 18th Ave,Wall,07719,Monmouth County,Wall Township Public School District,2020
185,Lakeland Regional High School,Public,9-12,205 Conklintown Road,Wanaque,07465,Passaic County,Lakeland Regional High School District,2020
186,Nutley High School,Public,9-12,300 Franklin Ave,Nutley,07110,Essex County,Nutley Public School District,2020
187,Essex County Donald M. Payne Senior School of Technology,Public,9-12,498-544 West Market St,Newark,07107,Essex County,Essex County Schools of Technology,2020
