rank,school,type,grades,address,city,zip,county,district,year
378,Eagle Academy for Young Men of Newark,Public,6-12,279 Chancellor Avenue,Newark,07112,Essex County,Newark Public School District,2020
379,East Orange Campus High School,Public,9-12,344 Prospect Street,East Orange,07017,Essex County,East Orange School District,2020
380,Thomas A. Edison Career and Technical Academy,Public,9-12,625 Summer St,Elizabeth,07202,Union County,Elizabeth Public Schools,2020
381,Henry Snyder High School,Public,9-12,239 Bergen Ave,Jersey City,07305,Hudson County,Jersey City Public Schools,2020
382,Pleasantville High School,Public,9-12,701 Mill Road,Pleasantville,08232,Atlantic County,Pleasantville Public School District,2020
383,Dr. Charles E. Brimm Medical Arts High School,Public,9-12,1875 Park Blvd,Camden,08103,Camden County,Camden City School District,2020
384,Asbury Park High School,Public,7-12,1001 Sunset Avenue,Asbury Park,07712,Monmouth County,Asbury Park School District,2020
385,Paulsboro High School,Public,9-12,670 N Delaware St,Paulsboro,08066,Gloucester County,Paulsboro School District,2020
386,John E. Dwyer Technology Academy,Public,9-12,123 Pearl St,Elizabeth,07202,Union County,Elizabeth Public Schools,2020
387,Penns Grove High School,Public,9-12,334 Harding Highway,Carneys Point,08069,Salem County,Penns Grove-Carneys Point Regional School District,2020
388,Bridgeton High School,Public,9-12,111 N West Avenue,Bridgeton,08302,Cumberland County,Bridgeton City School District,2020
389,Weequahic High School,Public,9-12,279 Chancellor Ave,Newark,07112,Essex County,Newark Public School District,2020
390,Academy Charter High School,"Public, Charter",9-12,1725 Main Street,Lake Como,07719,Monmouth County,Academy Charter High School,2020
391,Irvington High School,Public,9-12,1253      Clinton Ave,Irvington,07111,Essex County,Irvington Public School District,2020
392,Camden High School,Public,9-12,1700 Park Boulevard,Camden,08103,Camden County,Camden City School District,2020
393,Passaic High School No. 12,Public,9-12,170 Paulison Ave.,Passaic,07055,Passaic County,Passaic City School District,2020
394,Trenton Central High School - Main Campus,Public,10-12,400 Chambers Street,Trenton,08611,Mercer County,Trenton Public School District,2020
395,Lincoln High School,Public,9-12,60 Crescent Ave,Jersey City,07304,Hudson County,Jersey City Public Schools,2020
396,Middlesex County Vocational School East Bruns. School of Career Develop,Public,9-12,112 Rues Lane,East Brunswick,08816,Middlesex County,Middlesex County Vocational and Technical School District,2020
397,Barringer High School,Public,9-12,90 Parker St,Newark,07104,Essex County,Newark Public School District,2020
398,West Side High School,Public,9-12,403 South Orange Avenue,Newark,07103,Essex County,Newark Public School District,2020
399,Central High School,Public,9-12,250 18th Avenue,Newark,07103,Essex County,Newark Public School District,2020
400,John F. Kennedy High School,Public,9-12,61-127 Preakness Avenue,Paterson,07502,Passaic County,Paterson Public School District,2020
401,Woodrow Wilson High School,Public,9-12,3100 Federal Street,Camden,08105,Camden County,Camden City School District,2020
