rank,school,type,grades,address,city,zip,county,district,year
188,Spotswood High School,Public,9-12,105 Summerhill Road,Spotswood,08884,Middlesex County,Spotswood Public School District,2020
189,Hasbrouck Heights High School,Public,9-12,365 Boulevard,Hasbrouck Heights,07604,Bergen County,Hasbrouck Heights School District,2020
190,Hamilton East - Steinert,Public,9-12,2900 Klockner Road,Hamilton,08690,Mercer County,Hamilton Township Public School District,2020
191,Toms River High School North,Public,9-12,1245 Old Freehold Road,Toms River,08753,Ocean County,Toms River Regional School District,2020
192,Morristown High School,Public,9-12,50 Early Street,Morristown,07960,Morris County,Morris School District,2020
193,South Hunterdon Regional High School,Public,7-12,301 Mt Airy Harbourton Rd,Lambertville,08530,Hunterdon County,South Hunterdon Regional School District,2020
194,Vernon Township High School,Public,9-12,1832 Route 565,Vernon,07462,Sussex County,Vernon Township School District,2020
195,Waldwick High School,Public,9-12,155 Wyckoff Avenue,Waldwick,07463,Bergen County,Waldwick School District,2020
196,Audubon Junior/Senior High School,Public,7-12,350 Edgewood Avenue,Audubon,08106,Camden County,Audubon Public School District,2020
197,Salem County Career and Technical High School,Public,9-12,880 Route 45,Woodstown,08098,Salem County,Salem County Vocational Technical School District,2020
198,Colonia High School,Public,9-12,East Street,Colonia,07067,Middlesex County,Woodbridge Township School District,2020
199,Sussex County Technical School,Public,9-12,105 North Church Road,Sparta,07871,Sussex County,Sussex County Technical School District,2020
200,Atlantic County Institute of Technology,Public,9-12,5080 Atlantic Avenue,Mays Landing,08330,Atlantic County,Atlantic County Vocational School District,2020
201,High Point Regional High School District,Public,9-12,299 Pidgeon Hill Road,Sussex,07461,Sussex County,High Point Regional High School District,2020
202,Bergenfield High School,Public,9-12,80 S Prospect Ave,Bergenfield,07621,Bergen County,Bergenfield Borough School District,2020
203,Wood-Ridge Junior/Senior High School,Public,7-12,258 Hackensack St,Wood Ridge,07075,Bergen County,Wood-Ridge School District,2020
204,Collingswood High School,Public,9-12,424 Collings Ave,Collingswood,08108,Camden County,Collingswood Public School District,2020
205,West Orange High School,Public,9-12,51 Conforti Ave,West Orange,07052,Essex County,West Orange Public Schools,2020
206,Belvidere High School,Public,9-12,809 Oxford Street,Belvidere,07823,Warren County,Belvidere School District,2020
207,Middletown High School North,Public,9-12,63 Tindall Road,Middletown,07748,Monmouth County,Middletown Township Public School District,2020
208,Henry P. Becton Regional High School,Public,9-12,120 Paterson Avenue,East Rutherford,07073,Bergen County,Carlstadt-East Rutherford Regional High School District,2020
209,Hawthorne High School,Public,9-12,160 Parmelee Avenue,Hawthorne,07506,Passaic County,Hawthorne Public School District,2020
210,Woodstown High School,Public,9-12,140 East Avenue,Woodstown,08098,Salem County,Woodstown-Pilesgrove Regional School District,2020
211,Bordentown Regional High School,Public,9-12,318 Ward Ave,Bordentown,08505,Burlington County,Bordentown Regional School District,2020
212,Arthur L. Johnson High School,Public,9-12,365 Westfield Avenue,Clark,07066,Union County,Clark Township Public School District,2020
213,Secaucus High School,Public,9-12,11 Mill Ridge Road,Secaucus,07094,Hudson County,Secaucus School District,2020
214,Lyndhurst High School,Public,9-12,400 Weart Avenue,Lyndhurst,07071,Bergen County,Lyndhurst Public School District,2020
215,North Arlington High School,Public,9-12,222 Ridge Road,North Arlington,07031,Bergen County,North Arlington School District,2020
216,Bloomfield High School,Public,9-12,160 Broad Street,Bloomfield,07003,Essex County,Bloomfield Township School District,2020
217,Camden County Technical School-GTC,Public,9-12,343 Berlin Cross Keys Road,Sicklerville,08081,Camden County,Camden County Technical School District,2020
218,New Milford High School,Public,9-12,330 River Road,New Milford,07646,Bergen County,New Milford Public School District,2020
219,Burlington County Institute of Technology - Westampton,Public,9-12,695 Woodlane Road,Westampton,08060,Burlington County,Burlington County Institute of Technology School District,2020
220,Butler High School,Public,9-12,38 Bartholdi Avenue,Butler,07405,Morris County,Butler Public School District,2020
221,Wallington Junior Senior High School,Public,7-12,234 Main Ave,Wallington,07057,Bergen County,Wallington Boro School District,2020
222,Passaic Preparatory Academy,Public,6-12,252 Boulevard,Passaic,07055,Passaic County,Passaic City School District,2020
223,Dunellen High School,Public,9-12,411 First Street,Dunellen,08812,Middlesex County,Dunellen Public School District,2020
224,Red Bank Regional High School,Public,9-12,101 Ridge Road,Little Silver,07739,Monmouth County,Red Bank Regional School District,2020
225,Palisades Park Junior-Senior High School,Public,7-12,Veterans Plaza,Palisades Park,07650,Bergen County,Palisades Park School District,2020
226,Toms River High School East,Public,9-12,1225 Raider Way,Toms River,08753,Ocean County,Toms River Regional School District,2020
227,South River High School,Public,9-12,11 Montgomery Street,South River,08882,Middlesex County,South River Public School District,2020
228,Lower Cape May Regional High School,Public,9-12,687 Rt 9,Cape May,08204,Cape May County,Lower Cape May Regional School District,2020
229,Palmyra High School,Public,9-12,311 W 5th Street,Palmyra,08065,Burlington County,Palmyra Public School District,2020
230,Academy of Career and Technical Education,Public,9-12,One High Tech Way,Secaucus,07094,Hudson County,Hudson County Schools of Technology School District,2020
231,Bard Early College High School,Public,9-12,321 Bergen Street,Newark,07103,Essex County,Newark Public School District,2020
232,Lacey Township High School,Public,9-12,73 Haines Street,Lanoka Harbor,08734,Ocean County,Lacey Township School District,2020
233,North Brunswick Township High School,Public,9-12,98 Raider Road,North Brunswick,08902,Middlesex County,North Brunswick Township School District,2020
234,Absegami High School,Public,9-12,201 S  Wrangleboro Road,Galloway,08205,Atlantic County,Greater Egg Harbor Regional High School District,2020
235,Essex County Newark Technical,Public,9-12,209 Franklin St,Bloomfield,07003,Essex County,Essex County Schools of Technology,2020
236,Hopatcong High School,Public,8-12,2A Windsor Ave,Hopatcong,07843,Sussex County,Hopatcong Borough School District,2020
237,Woodbridge High School,Public,9-12,25 Samuel Lupo Place,Woodbridge,07095,Middlesex County,Woodbridge Township School District,2020
238,David Brearley Middle/High School,Public,7-12,401 Monroe Avenue,Kenilworth,07033,Union County,Kenilworth School District,2020
239,Burlington County Institute of Technology - Medford,Public,9-12,10 Hawkin Road,Medford,08055,Burlington County,Burlington County Institute of Technology School District,2020
240,Dover High School,Public,9-12,100 Grace Street,Dover,07801,Morris County,Dover Public School District,2020
241,Pitman High School,Public,9-12,225 Linden Avenue,Pitman,08071,Gloucester County,Pitman Boro School District,2020
242,Hamilton West-Watson,Public,9-12,2720 South Clinton Avenue,Hamilton,08610,Mercer County,Hamilton Township Public School District,2020
243,Foundation Academy Charter School,"Public, Charter, Alternative",K-12,363 West State Street,Trenton,08608,Mercer County,Foundation Academy Charter School,2020
244,Newton High School,Public,9-12,44 Ryerson Avenue,Newton,07860,Sussex County,Newton Public School District,2020
245,Willliamstown High School,Public,9-12,700 N Tuckahoe Rd,Williamstown,08094,Gloucester County,Monroe Township Public School District,2020
246,Bogota Junior/Senior High School,Public,8-12,2 Henry C  Luthin Place,Bogota,07603,Bergen County,Bogota Public School District,2020
247,Cliffside Park High School,Public,9-12,64 Riverview Avenue,Cliffside Park,07010,Bergen County,Cliffside Park School District,2020
248,South Amboy Middle/High School,Public,6-12,200 Governor Harold G  Hoffman,South Amboy,08879,Middlesex County,South Amboy School District,2020
249,Teaneck High School,Public,9-12,100 Elizabeth Ave,Teaneck,07666,Bergen County,Teaneck School District,2020
250,Raritan High School,Public,9-12,419 Middle Road,Hazlet,07730,Monmouth County,Hazlet Township Public School District,2020
251,Ocean Township High School,Public,9-12,550 West Park Avenue,Oakhurst,07755,Monmouth County,Township of Ocean School District,2020
252,Middlesex High School,Public,9-12,300 John F. Kennedy Drive,Middlesex,08846,Middlesex County,Middlesex Borough School District,2020
253,Union High School,Public,9-12,2350 North Third Street,Union,07083,Union County,Township of Union School District,2020
254,Hammonton High School,Public,9-12,566 Old Forks Road,Hammonton,08037,Atlantic County,Hammonton School District,2020
255,Monmouth Regional High School,Public,9-12,One Norman J  Field Way,Tinton Falls,07724,Monmouth County,Monmouth Regional High School,2020
256,Ridgefield Park Junior Senior High School,Public,7-12,1 Ozzie Nelson Drive,Ridgefield Park,07660,Bergen County,Ridgefield Park Public School District,2020
257,Barnegat High School,Public,9-12,180 Bengal Blvd,Barnegat,08005,Ocean County,Barnegat Township School District,2020
258,Hamilton North - Nottingham,Public,9-12,1055 Klockner Road,Hamilton,08619,Mercer County,Hamilton Township Public School District,2020
259,Jackson Liberty High School,Public,9-12,125 North Hope Chapel Road,Jackson,08527,Ocean County,Jackson Township School District,2020
260,Sterling High School,Public,9-12,501 South Warwick Road,Somerdale,08083,Camden County,Sterling Regional School District,2020
261,Passaic Valley Regional High School,Public,9-12,170 East Main Street,Little Falls,07424,Passaic County,Passaic Valley Regional High School District #1,2020
262,Arts High School,Public,9-12,550 M  L  King Blvd,Newark,07102,Essex County,Newark Public School District,2020
263,Ewing High School,Public,9-12,900 Parkway Ave,Ewing,08618,Mercer County,Ewing Township School District,2020
264,Great Oaks Legacy Charter School,"Public, Charter, Alternative","PK, KG-12",909 Broad Street,Newark,07102,Essex County,Great Oaks Legacy Charter School,2020
265,Carteret High School,Public,9-12,199 Washington Avenue,Carteret,07008,Middlesex County,Carteret Public School District,2020
266,West Milford High School,Public,9-12,67 Highlander Drive,West Milford,07480,Passaic County,West Milford Township Public School District,2020
267,Cicely L. Tyson Community Middle/High School,Public,6-12,35 Winans Street,East Orange,07017,Essex County,East Orange School District,2020
268,Pinelands Regional High School,Public,9-12,565 Nugentown Road,Little Egg Harbor,08087,Ocean County,Pinelands Regional School District,2020
269,Hackensack High School,Public,9-12,First & Beech Streets,Hackensack,07601,Bergen County,Hackensack School District,2020
270,Boonton High School,Public,9-12,306 Lathrop Avenue,Boonton,07005,Morris County,Boonton Town Public School District,2020
271,Camden County Technical School-Pennsauken,Public,9-12,6008 Browning Road,Pennsauken,08109,Camden County,Camden County Technical School District,2020
272,Paterson Arts and Science Charter School,"Public, Charter, Alternative",K-12,225 Grand Street,Paterson,07501,Passaic County,Paterson Arts and Science Charter School,2020
273,Alexander Hamilton Preparatory Academy,Public,9-12,310 Cherry St,Elizabeth,07208,Union County,Elizabeth Public Schools,2020
274,Bayonne High School,Public,9-12,669 Avenue A,Bayonne,07002,Hudson County,Bayonne School District,2020
275,Toms River High School South,Public,9-12,55 Hyers Street,Toms River,08753,Ocean County,Toms River Regional School District,2020
276,Hunterdon Polytech Bartles Corner Campus,Public,9-12,8 Bartles Corner Road,Flemington,08822,Hunterdon County,Hunterdon County Vocational School District,2020
277,Woodbury Junior-Senior High School,Public,6-12,25 N. Broad Street,Woodbury,08096,Gloucester County,Woodbury City Public School District,2020
278,Jefferson Township High School,Public,9-12,1010 Weldon Rd   Rd2,Oak Ridge,07438,Morris County,Jefferson Township Public School District,2020
279,Cherry Hill High School West,Public,9-12,2101 Chapel Ave.,Cherry Hill,08034,Camden County,Cherry Hill School District,2020
280,Bayonne Alternative High School,Public,9-12,669 Avenue A,Bayonne,07002,Hudson County,Bayonne School District,2020
281,Gateway Regional High School,Public,7-12,775 Tanyard Rd,Woodbury Hts,08096,Gloucester County,Gateway Regional High School District,2020
282,Wildwood High School,Public,9-12,4300 Pacific Ave,Wildwood,08260,Cape May County,Wildwood City School District,2020
283,Brick Township High School,Public,9-12,346 Chambers Bridge Rd,Brick,08723,Ocean County,Brick Township Public School District,2020
284,Passaic Arts and Science Charter School,"Public, Charter, Alternative",K-12,7 St. Francis Way,Passaic,07055,Passaic County,Passaic Arts and Science Charter School,2020
285,Innovation High School,Public,9-12,239 Bergen Avenue,Jersey City,07305,Hudson County,Jersey City Public Schools,2020
286,Belleville High School,Public,9-12,100 Passaic Ave,Belleville,07109,Essex County,Belleville Public School District,2020
287,Gloucester City High School,Public,9-12,1300 Market Street,Gloucester City,08030,Camden County,Gloucester City Public School District,2020
288,Franklin High School,Public,9-12,500 Elizabeth Avenue,Somerset,08873,Somerset County,Franklin Township Public School District,2020
289,Pennsauken High School,Public,9-12,800 Hylton Road,Pennsauken,08110,Camden County,Pennsauken Township Board of Education School District,2020
290,Timber Creek Regional High School,Public,9-12,501 Jarvis Road,Erial,08081,Camden County,Black Horse Pike Regional School District,2020
291,Pennsville Memorial High School,Public,9-12,110 S  Broadway,Pennsville,08070,Salem County,Pennsville School District,2020
292,Kearny High School,Public,9-12,336 Devon St,Kearny,07032,Hudson County,Kearny,2020
293,Deptford Township High School,Public,9-12,575 S Fox Run Rd,Deptford,08096,Gloucester County,Deptford Township Public School District,2020
294,Roselle Park High School,Public,9-12,185 W Webster Ave,Roselle Park,07204,Union County,Roselle Park Public School District,2020
295,Manville High School,Public,9-12,1100 Brooks Boulevard,Manville,08835,Somerset County,Manville School District,2020
296,Clifton High School,Public,9-12,333 Colfax Avenue,Clifton,07013,Passaic County,Clifton Public School District,2020
297,Rosa L. Parks School of Fine and Performing Arts,Public,9-12,413 12th Avenue,Paterson,07514,Passaic County,Paterson Public School District,2020
298,Clayton High School,Public,9-12,55 Pop Kramer Blvd,Clayton,08312,Gloucester County,Clayton Public School District,2020
299,The Barack Obama Green Charter High School,"Public, Charter",9-12,35 Watchung ave,Plainfield,07060,Union County,The Barack Obama Green Charter High School District,2020
300,Linden High School,Public,9-12,121 West St. Georges Ave.,Linden,07036,Union County,Linden Public School District,2020
301,Buena Regional High School,Public,9-12,125 Weymouth Road,Buena,08310,Atlantic County,Buena Regional School District,2020
302,TEAM Academy Charter School,"Public, Charter, Alternative",K-12,60 Park Place,Newark,07102,Essex County,TEAM Academy Charter School,2020
303,Garfield High School,Public,9-12,500 Palisade Ave,Garfield,07026,Bergen County,Garfield Public School District,2020
304,Manchester Township High School,Public,9-12,101 Hawks Way,Manchester,08759,Ocean County,Manchester Township School District,2020
305,Union County TEAMS Charter School,"Public, Charter, Alternative",K-12,515  517 West Fourth Street,Plainfield,07060,Union County,Union County TEAMS Charter School-High School/College LA,2020
306,Brick Township Memorial High School,Public,9-12,2001 Lanes Mill Rd,Brick,08724,Ocean County,Brick Township Public School District,2020
307,Creative Arts High School,Public,9-12,1875 Park Blvd,Camden,08103,Camden County,Camden City School District,2020
308,Pemberton Township High School,Public,9-12,148 Arneys Mount Road,Pemberton,08068,Burlington County,Pemberton Township School District,2020
309,Triton Regional High School,Public,9-12,250 Schubert Ave,Runnemede,08078,Camden County,Black Horse Pike Regional School District,2020
310,Thomas Jefferson Arts Academy,Public,9-12,27 Martin Luther King Jr Plaza,Elizabeth,07201,Union County,Elizabeth Public Schools,2020
311,Central Regional High School,Public,9-12,509 Forest Hills Parkway,Bayville,08721,Ocean County,Central Regional School District,2020
312,Hoboken High School,Public,9-12,Ninth & Clinton Sts,Hoboken,07030,Hudson County,Hoboken Public School District,2020
313,Maple Shade High School,Public,7-12,180 Frederick Ave,Maple Shade,08052,Burlington County,Maple Shade School District,2020
314,East Side High School,Public,9-12,238 Van Buren St,Newark,07105,Essex County,Newark Public School District,2020
315,Memorial High School,Public,9-12,5501 Park Ave,West New York,07093,Hudson County,West New York School District,2020
316,Perth Amboy High School,Public,9-12,300 Eagle Ave,Perth Amboy,08861,Middlesex County,Perth Amboy Public School District,2020
317,Overbrook Senior High School,Public,9-12,1200 Turnersville Road,Pine Hill,08021,Camden County,Pine Hill School District,2020
318,Memorial Senior High School,Public,9-12,375 River Dr,Elmwood Park,07407,Bergen County,Elmwood Park School District,2020
319,Hoboken Charter School,"Public, Charter, Alternative",K-12,713 Washington St,Hoboken,07030,Hudson County,Hoboken Charter School,2020
320,School of Earth and Space Science,Public,9-12,201 Memorial Drive,Paterson,07505,Passaic County,Paterson Public School District,2020
321,Mercer County Technical School Culinary Arts Academy,Public,9-12,129 Bull Run Road,Pennington,08534,Mercer County,Area Vocational Technical School District of Mercer County,2020
322,Highland Regional High School,Public,9-12,450 Erial Road,Blackwood,08012,Camden County,Black Horse Pike Regional School District,2020
323,Oakcrest High School,Public,9-12,1824 Dr  Dennis Foreman Drive,Mays Landing,08330,Atlantic County,Greater Egg Harbor Regional High School District,2020
324,Salem High School,Public,9-12,219 Walnut St,Salem,08079,Salem County,Salem City School District,2020
325,Glassboro High School,Public,9-12,560 Joseph L Bowe Blvd,Glassboro,08028,Gloucester County,Glassboro School District,2020
326,University Academy Charter High School,"Public, Charter",9-12,275 West Side Avenue,Jersey City,07305,Hudson County,University Academy Charter High School,2020
327,Middle Township High School,Public,9-12,300 East Atlantic Avenue,Cape May Court House,08210,Cape May County,Middle Township Public School District,2020
328,Malcolm X Shabazz High School,Public,9-12,80 Johnson Ave,Newark,07108,Essex County,Newark Public School District,2020
329,Essex County West Caldwell Technical,Public,9-12,620 Passaic Ave,West Caldwell,07006,Essex County,Essex County Schools of Technology,2020
330,North Plainfield High School,Public,9-12,34 Wilson Avenue,North Plainfield,07060,Somerset County,North Plainfield School District,2020
331,Mastery Schools of Camden Inc.,"Public, Alternative",K-12,1001 North 17th Street,Camden,08105,Camden County,Mastery Schools of Camden Inc.,2020
332,Leap Academy University Charter School,"Public, Charter, Alternative",K-12,130 North Broadway,Camden,08102,Camden County,LEAP Academy University Charter School,2020
333,Marion P. Thomas Charter School,"Public, Charter, Alternative","PK, KG-12",125 Sussex Ave,Newark,07103,Essex County,Marion P. Thomas Charter School,2020
334,Hillside High School,Public,9-12,1085 Liberty Ave,Hillside,07205,Union County,Hillside Public School District,2020
335,Passaic County-Manchester Regional High School,Public,9-12,70 Church Street,Haledon,07508,Passaic County,Passaic County Manchester Regional High School District,2020
336,Peoples Preparatory Charter School,"Public, Charter",9-12,321 Bergen Street,Newark,07103,Essex County,Peoples Preparatory Charter School District,2020
337,Camden's Promise Charter School,"Public, Charter, Alternative","PK, KG-12",879 Beideman Ave,Camden,08105,Camden County,Camden's Promise Charter School,2020
338,Paterson Charter School for Science/Technology,"Public, Charter, Alternative",K-12,196 West Railway Avenue,Paterson,07503,Passaic County,Paterson Charter School for Science and Technology,2020
339,International High School,Public,9-12,200 Grand Street,Paterson,07501,Passaic County,Paterson Public School District,2020
340,Winslow Township High School,Public,9-12,10 Cooper Folly Road,Atco,08004,Camden County,Winslow Township School District,2020
341,Burlington City High School,Public,7-12,100 Blue Devil Way,Burlington,08016,Burlington County,Burlington City Public School District,2020
342,Rahway High School,Public,9-12,1012 Madison Ave,Rahway,07065,Union County,Rahway Public School District,2020
343,Middlesex County Vocational School Perth Amboy,Public,9-12,457 High Street,Perth Amboy,08861,Middlesex County,Middlesex County Vocational and Technical School District,2020
344,Chartertech High School for the Performing Arts,"Public, Charter",9-12,413 New Road,Somers Point,08244,Atlantic County,Chartertech High School for the Performing Arts,2020
345,North Bergen High School,Public,9-12,7417 Kennedy Blvd,North Bergen,07047,Hudson County,North Bergen School District,2020
346,Atlantic City High School,Public,9-12,1400 N Albany Avenue,Atlantic City,08401,Atlantic County,Atlantic City School District,2020
347,Neptune High School,Public,9-12,55 Neptune Boulevard,Neptune,07753,Monmouth County,Neptune Township School District,2020
348,Lakewood High School,Public,9-12,855 Somerset Avenue,Lakewood,08701,Ocean County,Lakewood Township School District,2020
349,Middlesex County Vocational School Piscataway,Public,9-12,21 Suttons Lane,Piscataway,08854,Middlesex County,Middlesex County Vocational and Technical School District,2020
350,American History High School,Public,9-12,74 Montgomery St,Newark,07103,Essex County,Newark Public School District,2020
351,Camden Big Picture Learning Academy,Public,9-12,1875 Park Boulevard,Camden,08103,Camden County,Camden City School District,2020
352,Vineland Senior High School,Public,9-12,2880 E Chestnut Ave,Vineland,08360,Cumberland County,Vineland Public School District,2020
353,Bergen County Technical High School - Paramus,Public,9-12,E.285 Pascack Road,Paramus,07652,Bergen County,Bergen County Vocational Technical School District,2020
354,Union City High School,Public,9-12,2500 Kennedy Blvd,Union City,07087,Hudson County,Union City School District,2020
355,William L Dickinson High School,Public,9-12,2 Palisade Ave,Jersey City,07306,Hudson County,Jersey City Public Schools,2020
356,Academy for Urban Leadership Charter School,"Public, Charter",7-12,612 Amboy Ave,Perth Amboy,08861,Middlesex County,Academy for Urban Leadership Charter School,2020
357,Orange High School,Public,9-12,400 Lincoln Ave,Orange,07050,Essex County,ORANGE BOARD OF EDUCATION School District,2020
358,Freedom Prep Charter School,"Public, Charter, Alternative",K-12,1000 Atlantic AVE,Camden,08104,Camden County,Freedom Prep Charter School,2020
359,University High School,Public,7-12,55 Clinton Pl,Newark,07108,Essex County,Newark Public School District,2020
360,Trenton Stem-to-Civics Charter School,"Public, Charter",6-12,1555 Pennington Raod,Ewing,08618,Mercer County,Trenton Stem-to-Civics Charter School,2020
361,J. Christian Bollwage Finance Academy,Public,9-12,447 Richmond Street,Elizabeth,07202,Union County,Elizabeth Public Schools,2020
362,Keyport High School,Public,9-12,351 Broad Street,Keyport,07735,Monmouth County,Keyport School District,2020
363,School of Health Science,Public,9-12,764 11th Avenue,Paterson,07514,Passaic County,Paterson Public School District,2020
364,Willingboro High School,Public,9-12,20 Jfk Way,Willingboro,08046,Burlington County,Willingboro Public School District,2020
365,Long Branch High School,Public,9-12,404 Indiana Avenue,Long Branch,07740,Monmouth County,LONG BRANCH PUBLIC SCHOOL District,2020
366,Academy of Technology Design,Public,9-12,525 Montgomery Street,Jersey City,07302,Hudson County,Hudson County Schools of Technology School District,2020
367,Cumberland Regional High School,Public,9-12,90 Silver Lake Road,Bridgeton,08302,Cumberland County,Cumberland Regional School District,2020
368,Keansburg High School,Public,9-12,140 Port Monmouth Road,Keansburg,07734,Monmouth County,Keansburg School District,2020
369,Lindenwold High School,Public,9-12,801 Egg Harbor Road,Lindenwold,08021,Camden County,Lindenwold Public School District,2020
370,James J Ferris High School,Public,9-12,35 Colgate St,Jersey City,07302,Hudson County,Jersey City Public Schools,2020
371,Abraham Clark High School,Public,9-12,122 East 6th Ave,Roselle,07203,Union County,Roselle Public School District,2020
372,New Brunswick High School,Public,9-12,1000 Somerset St,New Brunswick,08901,Middlesex County,New Brunswick School District,2020
373,Admiral William F. Halsey Junior Health & Public Safety Academy,Public,9-12,641 South Street,Elizabeth,07202,Union County,Elizabeth Public Schools,2020
374,Harrison High School,Public,9-12,401 Kingsland Avenue,Harrison,07029,Hudson County,Harrison Public Schools,2020
375,Bound Brook High School,Public,9-12,111 West Union Avenue,Bound Brook,08805,Somerset County,Bound Brook School District,2020
376,Memorial High School,Public,9-12,504 East Broad Street,Millville,08332,Cumberland County,Millville School District,2020
377,Riverside High School,Public,9-12,112 E Washington Street,Riverside,08075,Burlington County,Riverside Township School District,2020
